신문사,제목,본문,본문_요약,링크,카테고리,예측점수,업계_키워드_개수,경영_키워드_개수,최종선택여부
한국경제,"부산시, 명례·정관산단 구원투수로 나선다","제2차 기업 혁신성장 간담회박형준 시장, 기업인과 직접 미팅공업용수 공급·주차장 확보 등애로사항 청취 뒤 '원스톱 지원'임시도로 개설…1008억 투자 유치지역기업 간 협업 이끌어내기도박형준 부산시장이 지역 기업인들과의 접점 확대에 나섰다. 지난해 기업 전담 ‘1호 PM’을 자처한 뒤 지역 산업단지 소재 기업인과의 정례적인 간담회를 마련해 산단 지원 정책을 새롭게 짜는 체계를 구축했다. 박 시장이 기업인 간 미팅 주선자로 나서 위기 돌파 해법을 제시하기도 했다.◇기업 현장 방문으로 투자 유치박 시장은 18일 기장군 정관 산단을 방문해 인근 명례·정관산단 입주 기업과 ‘제2차 기업 혁신성장 릴레이 간담회’를 열었다. 최순환 그린조이 회장과 노응범 동신제지 대표 등 21명의 기업인이 간담회에 참석했다. 이날 현장에선 기장군 일원을 분산에너지 특구로 지정해야 한다는 의견과 함께 산단 입주 업종 재지원, 산단 공업용수 공급 시기 단축, 주차장 공간 확보 등 다양한 건의가 이어졌다.박 시장의 이날 행보는 지난달 1차 간담회에 이은 것으로, 앞으로도 정례적으로 기업인과의 소통을 강화해 나간다는 계획이다. 1차 간담회에선 정진근 효성전기 회장이 산단 인근 주택 공급 확대가 필요하다는 의견을 제시해 정책 개발로 이어지기도 했다. 이 밖에도 장안산단의 공공 폐수처리장 증설, 정보보안 교육 및 시스템 구축 지원, 인력 문제 해결, 각종 우회 도로와 연결도로 개설 등의 사안이 해결되거나 사업 추진에 들어갔다.기업인과의 간담회는 지난해 신설한 ‘원스톱기업지원단’이 진화한 형태라는 평가를 받는다. 박 시장은 지원단 설립과 함께 ‘기업 전담 매니저’를 자처하고 부산상공회의소와 함께 다양한 기업 현장을 방문했다. 이 기간 굵직한 성과도 냈다. LS일렉트릭의 공사용 임시도로 개설 민원을 해결해 1008억원의 신규 투자 유치를 끌어낸 게 대표적인 사례로 꼽힌다.◇박 시장이 끌어낸 트렉스타 신제품부산을 대표하는 아웃도어 신발 브랜드 트렉스타와 지역 혁신 스타트업을 연결하는 주선자가 되기도 했다. 박 시장은 지난 7월 이민봉 크리스틴컴퍼니 대표를 불러 트렉스타와의 협업을 제안했다.당시 트렉스타는 코로나19 팬데믹을 지나 러시아와 우크라이나 간 전쟁으로 재고가 쌓인 상황이었다. 크리스틴컴퍼니는 신발의 모든 제조 공정을 아우르는 전국 400여 개 공장을 데이터화한 뒤 인공지능(AI)이 제조사에 맞춤형으로 제조 공장을 추천하는 플랫폼을 개발했다.특히 최근에는 디자이너가 텍스트와 이미지 등을 입력하면 AI가 디자인을 뽑아내는 ‘슈캐치’ 플랫폼까지 개발했다. 신발 디자인 기획부터 제조까지 한 달 만에 끝내는 시스템이 만들어진 것이다.두 기업의 협업으로 지난달 결과물이 나왔다. 트렉스타는 크리스틴컴퍼니의 플랫폼을 빌려 파크골프화 개발에 성공했다. 신발 디자인은 30~40대도 신을 수 있는 모델이다. 이민봉 대표는 “신발 디자이너 신규 유입이 없어 고령화하고 있는 게 문제”라며 “이 플랫폼으로 트렉스타 제품 디자인이 젊어질 것”이라고 말했다.박 시장은 “사소해 보이는 규제 해소가 대규모 투자로 이어질 수 있다”며 “기업이 지역에 안착하고 성장하는 시스템을 만들어 나갈 것”이라고 강조했다.부산=민건태 기자 minkt@hankyung.com","제2차 기업 혁신성장 간담회박형준 시장, 기업인과 직접 미팅공업용수 공급·주차장 확보 등애로사항 청취 뒤 '원스톱 지원'임시도로 개설…1008억 투자 유치지역기업 간 협업 이끌어내기도박형준 부산시장이 지역 기업인들과의 접점 확대에 나섰다. 지난해 기업 전담 ‘1호 PM’을 자처한 뒤 지역 산업단지 소재 기업인과의 정례적인 간담회를 마련해 산단 지원 정책을 새롭게 짜는 체계를 구축했다. 박 시장이 기업인 간 미팅 주선자로 나서 위기 돌파 해법을 제시하기도 했다.◇기업 현장 방문으로 투자 유치박 시장은 18일 기장군 정관 산단을 방문해 인근 명례·정관산단 입주 기업과 ‘제2차 기업 혁신성장 릴레이 간담회’를 열었다. 최순환 그린조이 회장과 노응범 동신제지 대표 등 21명의 기업인이 간담회에 참석했다. 이날 현장...",https://n.news.naver.com/article/newspaper/015/0005212928?date=20251119,경영,7.79E-05,0,1,
조선일보,[특파원 리포트] 서해 위기 앞 ‘실용 외교’의 향방,"이재명 대통령이 대선 후보로 떠오르기 전부터 미국 조야(朝野)의 선입견은 상당했다. 워싱턴 DC의 외교·안보 전문가들은 그가 집권하면 한미 동맹에 불협화음이 일 가능성이 크고, 한일 관계가 문재인 정부 시절로 역행해 애써 공들인 한·미·일 삼각 협력이 흔들릴 것으로 봤다. “중국에도 셰셰(謝謝·고맙다), 대만에도 셰셰 하면 된다”는 인식 또한 중국 패권주의를 견제하려는 자유·민주 진영의 전열을 헝클 것으로 우려했다. 2023년 한 외신 기자가 그에게 “당신은 위험 인물인가”라고 물은 적도 있다. ‘선동가(firebrand)’란 수식어가 붙는 그의 기질이 도널드 트럼프 대통령의 기질과 어우러질 수 있는가에 관한 걱정도 적지 않았다.이 대통령은 취임 이후 이런 선입견을 하나둘 깨고 있다. 첫 미국 방문에서 “더 이상 안미경중(안보는 미국, 경제는 중국) 할 수 없다”며 보수 대통령들도 하기 어려웠던 말을 꺼냈다. “자위대 군홧발이 다시 한반도를 더럽힐 수 있다”던 2년 전 말이 무색하게 일본과는 찰떡궁합을 과시하고 있다. ‘셰셰 외교’도 한때의 수사였나 보다. 최근 한미가 발표한 팩트시트에는 대만 해협에서의 일방적 현상 변경 반대, 항행(航行)·상공 비행의 자유 준수, 모든 나라의 국제법에 부합하는 해양 영유권 주장 등이 두루 언급돼 있다. 암호문 같지만 모두 중국을 겨냥한 문구다. 압권은 트럼프 면전에서 원자력 추진 잠수함을 도입하려는 이유로 ‘중국 잠수함에 대한 추적 제한’을 꼽은 대목이었다.한미 동맹을 근간으로 하되 한중 관계도 관리하겠다는 게 이 정부의 ‘실용 외교’다. 한국이 동북아에서 미·중 같은 패권 세력의 균형추 역할을 할 수 있고, 한반도 문제의 ‘운전자’가 될 수 있다는 역대 진보 정부의 희망 사항을 답습하고 있다. 하지만 지금 국제 정세는 외교 앞에 ‘실용’을 붙이기 점점 더 어려운 분위기로 흐르고 있다. 일본 총리처럼 굳이 민감한 현안을 들쑤시며 선제적으로 나설 필요도 없지만, 어설프게 두 마리 토끼를 다 잡으려다가는 낙동강 오리알 신세가 될 위험성이 커진 것이다.요즘 미 외교가는 중국이 완력을 과시하는 서해에서 한국이 국제 규범을 어떻게 수호할지 촉각을 세우고 지켜보고 있다. 우리 조사선과 중국 해경이 15시간 동안 대치한 사실이 한 싱크탱크 보고서로 뒤늦게 알려진 일도 있었다. 전문가들은 “중국의 불법적 해양 영유권 주장을 쉬쉬하다 대응의 골든타임을 놓친 남중국해 꼴이 날 수 있다” “지금 바로잡지 않으면 더 큰 위험이 온다”고 경고한다. 시진핑 주석에게 경주 황남빵을 선물하고 반중(反中) 시위를 자제시키는 실용 외교로는 통하지 않는다. 냉혹한 국제 현실 앞에서 중국을 상대하는 일의 우선순위를 택하지 않는다면 우리가 외면한 진실이 큰 재앙으로 돌아올 것이다.매일 조선일보에 실린 칼럼 5개가 담긴 뉴스레터를 받아보세요. 세상에 대한 통찰을 얻을 수 있습니다.'5분 칼럼' 더보기(https://www.chosun.com/tag/5mins-column/)","이재명 대통령이 대선 후보로 떠오르기 전부터 미국 조야(朝野)의 선입견은 상당했다. 워싱턴 DC의 외교·안보 전문가들은 그가 집권하면 한미 동맹에 불협화음이 일 가능성이 크고, 한일 관계가 문재인 정부 시절로 역행해 애써 공들인 한·미·일 삼각 협력이 흔들릴 것으로 봤다. “중국에도 셰셰(謝謝·고맙다), 대만에도 셰셰 하면 된다”는 인식 또한 중국 패권주의를 견제하려는 자유·민주 진영의 전열을 헝클 것으로 우려했다. 2023년 한 외신 기자가 그에게 “당신은 위험 인물인가”라고 물은 적도 있다. ‘선동가(firebrand)’란 수식어가 붙는 그의 기질이 도널드 트럼프 대통령의 기질과 어우러질 수 있는가에 관한 걱정도 적지 않았다.이 대통령은 취임 이후 이런 선입견을 하나둘 깨고 있다. 첫 미국 방문에서 “더...",https://n.news.naver.com/article/newspaper/023/0003941790?date=20251119,경영,7.72E-05,0,1,
매일경제,주차 빈자리 척척 … AI 아파트 '성큼',"건설사, 앞다퉈 AI 기술 접목수면패턴 분석해 조명 조절냉난방 제어해 관리비 절약노년층 대상 비대면 진료도입주민 편의·안전까지 케어경기도는 '관리비 제로' 목표건설업계가 인공지능(AI) 기술을 주거 공간 곳곳에 접목하며 입주민의 편의와 안전, 건강까지 책임지는 'AI 아파트' 시대를 열고 있다. AI가 주거 데이터를 학습하고 스스로 환경을 제어하며 삶의 질을 높이는 맞춤형 주거 서비스가 현실화하는 모습이다. 주차장을 통해 귀가하는 순간부터 집 안에서의 일상 그리고 잠자리에 들 때까지 AI가 생활 전반을 빈틈없이 관리하는 시대가 다가오고 있다.18일 삼성물산 건설부문은 서울 서초구 방배동 '래미안원페를라'에 '래미안 AI 주차장'을 최초로 도입한다고 밝혔다. 오는 26일 입주를 시작하는 이 단지의 주차장은 주차 관제·유도, 전기차 충전 시스템을 통합 연동하고 AI 기술과 결합했다. 입주민의 평소 주차 데이터를 분석해 선호하는 주차 위치나 거주동과 가까운 곳으로 추천·안내한다. 방문 차량에도 사전 예약 정보를 바탕으로 최단 경로와 최적의 주차 위치를 제공한다.HDC현대산업개발이 노원구 월계동에 조성하는 서울원 아이파크 주차장에는 지능형 AI 폐쇄회로(CC)TV를 설치해 화재를 사전에 감지하고 신속하게 대응할 수 있도록 설계했다. 특히 전기차 급속 충전기 주차면에는 열영상 카메라를 배치해 전기차 배터리 온도가 일정 기준 이상 상승하는지를 지속해서 감시하고 화재 감지 시 자동으로 충전을 중지한다.일상에서도 AI가 주거 편의를 끌어올리고 에너지 효율을 높이는 역할을 하게 될 전망이다. 서울원 아이파크에는 AI 홈에이전트 기반 주거 어시스턴트가 적용돼 입주민 생활 패턴과 단지 데이터를 학습한다. 이를 기반으로 에너지 관리와 커뮤니티 시설 예약 등 맞춤형 서비스를 제공한다. AI 음성인식 월패드는 생성형 AI 기반 기술을 적용해 복잡한 질문에도 문맥을 이해한다.AI 기술은 입주민의 관리비 절감에도 '효자' 노릇을 할 전망이다. 경기도는 지난 3월 '관리비 제로 아파트 비전'을 공개했다. 신축 아파트 80만가구를 대상으로 신재생에너지에 AI 기술을 접목해 전기·냉난방비 등 공동주택 관리비를 줄이고 2040년에는 에너지 비용을 제로화한다는 계획이다.기존(기축) 공동주택에서도 '우리 집 아파트 AI 절약 프로젝트'가 실증 단계를 밟고 있다. AI가 냉난방, 조명, 환기, 가전 등을 거주자의 선호도와 생활 방식에 맞춰 자동 제어해 입주민이 별도 장비를 조작하지 않아도 효율적으로 관리비를 절약해주는 시대가 현실화할 전망이다.대우건설은 AI 기반 비대면 시니어 헬스케어 서비스를 준비하고 있다. 단지 내 시니어클럽에 헬스케어 라운지를 운영하며 AI 의료 서비스 기반 자가 검진, 병원 연계 그리고 의사와의 비대면 진료 및 처방전 발급 등의 서비스 제공을 기획 중이다.하루를 마무리하는 침실에서도 AI는 입주민의 건강과 웰니스를 책임진다. 현대건설이 개발한 AI 기반 수면케어 솔루션 '헤이슬립(Hey, Sleep)'은 개인별 수면 데이터를 분석해 조도, 습도, 환기 등 맞춤형 수면 환경을 능동적으로 설정하는 시스템이다.[박재영 기자]","건설사, 앞다퉈 AI 기술 접목수면패턴 분석해 조명 조절냉난방 제어해 관리비 절약노년층 대상 비대면 진료도입주민 편의·안전까지 케어경기도는 '관리비 제로' 목표건설업계가 인공지능(AI) 기술을 주거 공간 곳곳에 접목하며 입주민의 편의와 안전, 건강까지 책임지는 'AI 아파트' 시대를 열고 있다. AI가 주거 데이터를 학습하고 스스로 환경을 제어하며 삶의 질을 높이는 맞춤형 주거 서비스가 현실화하는 모습이다. 주차장을 통해 귀가하는 순간부터 집 안에서의 일상 그리고 잠자리에 들 때까지 AI가 생활 전반을 빈틈없이 관리하는 시대가 다가오고 있다.18일 삼성물산 건설부문은 서울 서초구 방배동 '래미안원페를라'에 '래미안 AI 주차장'을 최초로 도입한다고 밝혔다. 오는 26일 입주를 시작하는 이 단지의 주차장은 주...",https://n.news.naver.com/article/newspaper/009/0005592195?date=20251119,업계,7.67E-05,1,0,
조선일보,역사가 겹쳐지는 순간… 피라미드 앞 우뚝 선 韓 작가 작품,"이집트 개최 ‘포에버 이즈 나우’韓 유일 초청 작가 박종규 신작불멸을 향한 고대 이집트인의 염원 앞에 현대인의 욕망이 겹쳐졌다. 이집트 카이로 남서쪽 기자 사막. 유네스코 세계문화유산인 4500년 전 석조 피라미드 앞에 빨강·노랑·파랑 삼원색 기하학 구조물이 들어섰다. 피라미드 형태로 우뚝 솟은 삼각 구조물 사이로 높이 146m에 이르는 고대 이집트 쿠푸왕의 피라미드가 쏙 들어왔다. 모래 바닥에 점점이 박힌 1000개의 아크릴 거울이 태양 아래 눈부시게 반짝였다. 한국 작가 박종규(59)의 신작 ‘영원의 코드’가 시공간을 뛰어넘어 고대 인류와 연결된 순간이다.15일(현지 시각) 카이로 기자 피라미드 앞에서 국제미술제 ‘포에버 이즈 나우(Forever is Now)’가 공식 개막했다. 아프리카·중동 지역에서 가장 주목받는 국제전으로 꼽히는 이 행사는 이집트 비영리 플랫폼 ‘아르 데집트’가 주최하고, 이집트 외교부·문화부·관광유물부의 후원과 유네스코 협력으로 매년 가을 열린다. 올해는 10국 작가 10명(팀)이 참여했고, 한국 작가로는 유일하게 박종규가 초청받았다. 피라미드 앞에서 신작을 선보이는 것은 지난해 강익중에 이어 두 번째다.‘영원의 코드’는 피라미드의 고유한 수학적 구조와 한국·이집트 고대 역사를 사막 위에서 디지털 언어로 재해석한 작품이다. 박종규는 실제 피라미드의 높이와 변의 길이를 기반으로 정사각형 프레임 안에 삼각 구조물을 구현했다. 현장에서 만난 작가는 “피라미드는 인류가 남긴 가장 오래된 기하학적 구조물이자 하나의 거대한 코드”라며 “제가 만든 구조물이 피라미드와 서로 마주 보고 호흡하는 장면을 보는 순간, 시간이 겹쳐진 풍경이 눈앞에 펼쳐지는 기분이었다”고 했다. “4500년 전의 기하학이 현재의 기하학적 언어와 연결되는 느낌을 강하게 받았다. 수천 년의 시간과 현대의 기술적 구조가 한 지점에서 합쳐지면서, 피라미드가 제 작품의 일부가 된 것처럼 느껴질 정도로 자연스럽게 이어져 있었다.”올해 ‘포에버 이즈 나우’의 키워드는 ‘디지털’과 ‘영원’. 이규현 큐레이터는 “한국과 이집트의 고대 역사를 잇고 피라미드의 고유성을 디지털 언어로 해석한 박종규의 작품은 올해 전시의 주제를 가장 잘 구현한 작품”이라며 “현지 언론에서도 주요 작품으로 꼽을 정도로 주목받고 있다”고 했다. 고대 이집트인들이 파라오의 영생을 기원하며 만든 위대한 건축물(피라미드)과 순간을 영원히 남기기 위한 현대인의 욕망(디지털)이 겹쳐진다는 것, 결국 시공간을 초월해 고대와 현대, 미래까지 인류는 연결돼 있다는 얘기다.구조물을 둘러싼 주변에는 약 1000개의 점들이 아크릴 거울로 박혀 있다. 디지털 매체 속 픽셀 왜곡을 연상시키는 이 점들은 단군 신화의 건국 시조인 단군이 이집트 파라오에게 보내는 편지를 상상하며 작가가 직접 쓴 시를 모스 부호로 암호화했다. 작가는 “아날로그 언어를 디지털 언어로 전환해, 시공간을 초월한 교감 언어로 다시 쏘아 올리는 장치”라며 “마치 우리가 고대 이집트 벽화를 해독하듯, 관객들도 ‘이 암호는 무엇일까?’라는 호기심과 사유를 느끼기 바란다”고 했다.‘아르 데집트’ 설립자 나딘 압델 가파르는 “‘포에버 이즈 나우’는 고대 이집트 역사와 현대미술, 과거와 현재, 미래를 연결하는 예술의 힘을 보여주는 국제전”이라며 “세계 각국 예술가들이 상징적 유적 앞에서 하나의 대화를 나누는 글로벌 담론으로 자리잡았다”고 했다. 12월 6일까지.",이집트 개최 ‘포에버 이즈 나우’韓 유일 초청 작가 박종규 신작불멸을 향한 고대 이집트인의 염원 앞에 현대인의 욕망이 겹쳐졌다. 이집트 카이로 남서쪽 기자 사막. 유네스코 세계문화유산인 4500년 전 석조 피라미드 앞에 빨강·노랑·파랑 삼원색 기하학 구조물이 들어섰다. 피라미드 형태로 우뚝 솟은 삼각 구조물 사이로 높이 146m에 이르는 고대 이집트 쿠푸왕의 피라미드가 쏙 들어왔다. 모래 바닥에 점점이 박힌 1000개의 아크릴 거울이 태양 아래 눈부시게 반짝였다. 한국 작가 박종규(59)의 신작 ‘영원의 코드’가 시공간을 뛰어넘어 고대 인류와 연결된 순간이다.15일(현지 시각) 카이로 기자 피라미드 앞에서 국제미술제 ‘포에버 이즈 나우(Forever is Now)’가 공식 개막했다. 아프리카·중동 지역에서 ...,https://n.news.naver.com/article/newspaper/023/0003941819?date=20251119,기타,7.64E-05,0,0,
한국경제,"中, 여행·유학 이어 日영화 금지령","만화영화 '짱구' 개봉 중단 조치日총리 '대만 유사시 개입' 발언에中, 연일 고강도 비난 쏟아내다카이치 사나에 일본 총리의 ‘대만 유사시 개입’ 시사 발언을 계기로 중국에서 ‘한일령’(限日令·일본과의 관계 제한 조치)이 확산하고 있다. 일본 여행과 유학 자제령이 나온 데 이어 일본 영화의 중국 내 개봉까지 중단되고 있다.관영 CCTV는 18일 “극장판 ‘짱구는 못 말려: 초화려! 작열하는 떡잎마을 댄서즈’ ‘일하는 세포’ 등 수입 일본 영화 상영이 중단될 것”이라고 보도했다. 앞서 중국 매체들은 두 영화의 중국 배급사가 전날 오후 개봉 취소 통지를 받았다고 전했다.CCTV는 최근 일본 애니메이션 ‘귀멸의 칼날: 무한성편’이 중국에서 개봉했지만 다카이치 총리의 ‘대만 발언’으로 중국 관람객의 강한 불만을 유발했다고 강조했다. 개봉 직후 뚜렷한 하락세에 접어들면서 박스오피스 매출이 빠르게 하락했다는 설명이다.이날 중국 측은 베이징을 방문한 가나이 마사아키 일본 외무성 아시아대양주국장에게 고압적인 태도를 보이기도 했다.류진쑹 중국 외교부 아시아국장이 가나이 국장과의 회담을 마친 뒤 주머니에 손을 넣은 채 굳은 표정으로 가나이 국장을 내려다보고, 가나이 국장은 고개를 숙인 모습(사진)을 담은 동영상도 확산했다. 이 영상은 CCTV 계열 소셜미디어 계정 ‘위위안탄톈’에 올라왔다. 이 때문에 중국 측이 이 장면을 의도적으로 공개·유포했다는 관측이 나온다. 마오닝 중국 외교부 대변인은 이날 정례 브리핑에서 류 국장이 다카이치 총리의 대만 관련 발언에 대해 가나이 국장에게 다시 한번 엄정 항의했다고 밝혔다. 다카이치 총리는 지난 7일 중의원(하원)에서 일본 현직 총리로는 처음으로 ‘대만 유사시’는 일본이 집단 자위권(무력)을 행사할 수 있는 ‘존립 위기 사태’에 해당할 수 있다고 밝혔다. 중국은 이에 반발하며 연일 고강도 비난을 쏟아냈다. 하지만 다카이치 총리는 발언을 철회할 생각이 없다고 선을 그었다.중국은 ‘일본 치안 문제’를 이유로 자국민에게 일본 여행 자제를 권고했다. 유학생의 일본행도 신중히 검토하라고 공지하는 등 당국 차원의 통제 카드를 꺼내고 있다.베이징=김은정 특파원 kej@hankyung.com","만화영화 '짱구' 개봉 중단 조치日총리 '대만 유사시 개입' 발언에中, 연일 고강도 비난 쏟아내다카이치 사나에 일본 총리의 ‘대만 유사시 개입’ 시사 발언을 계기로 중국에서 ‘한일령’(限日令·일본과의 관계 제한 조치)이 확산하고 있다. 일본 여행과 유학 자제령이 나온 데 이어 일본 영화의 중국 내 개봉까지 중단되고 있다.관영 CCTV는 18일 “극장판 ‘짱구는 못 말려: 초화려! 작열하는 떡잎마을 댄서즈’ ‘일하는 세포’ 등 수입 일본 영화 상영이 중단될 것”이라고 보도했다. 앞서 중국 매체들은 두 영화의 중국 배급사가 전날 오후 개봉 취소 통지를 받았다고 전했다.CCTV는 최근 일본 애니메이션 ‘귀멸의 칼날: 무한성편’이 중국에서 개봉했지만 다카이치 총리의 ‘대만 발언’으로 중국 관람객의 강한 불만을 유발...",https://n.news.naver.com/article/newspaper/015/0005213012?date=20251119,기타,7.59E-05,0,0,
