신문사,제목,본문,본문_요약,링크,카테고리,예측점수,업계_키워드_개수,경영_키워드_개수,최종선택여부
한국경제,"SKT에 '최대 7조' 유심 유출 위로금 부과 논란…""해킹 은폐 부추기는 꼴""","정신적 손해배상 부작용 우려업계 ""피해 입증 없이 돈 주는 격""자율적 개선 노력 위축 가능성SKT는 조정안 수용 불가 입장유심(USIM) 정보 유출로 SK텔레콤에 부과된 1인당 30만원의 정신적 손해배상 권고안을 두고 논란이 불거지고 있다. 개인정보분쟁조정위원회가 분쟁 신청을 받아들인 인원은 3998명뿐이지만, SK텔레콤이 이를 수용할 경우 줄소송에 휘말릴 수 있어서다. 통신업계에선 이번 조정안이 기업의 자율적 개선 노력을 위축시키는 ‘역인센티브’로 작용할 수 있다는 우려가 나온다.18일 업계에 따르면 SK텔레콤은 20일 마감인 조정안 수용 여부와 관련해 ‘불가’ 입장을 고수하고 있는 것으로 알려졌다. 3998명에게 지불할 보상금은 11억9940만원에 불과하지만, 이로 인해 분쟁조정 신청이 쇄도할 가능성이 높기 때문이다. 회사 측은 분쟁조정금이 최대 7조원에 달할 것으로 예상하고 있다.이해 당사자인 통신업계뿐만 아니라 전문가들도 이번 조치의 부작용을 우려하고 있다. 조정 제도의 본래 목적이 피해자 구제와 더불어 기업의 자체 복원력을 높이고 예방체계를 강화하도록 유도하는 것인데 자칫하면 기업의 존립 자체를 흔들 수 있다는 것이다. 통신업계 관계자는 “자발적 조치 이후에도 이번 사안처럼 고액의 금전조정이 내려진다면 기업들은 선제적 조치보다 방어적 대응이 낫다는 결론에 이를 가능성이 크다”고 말했다. 이 같은 역인센티브는 장기적으로 산업 전반의 보안 투자 위축과 사고 은폐를 초래한다는 지적이다.조정 대상이 된 SK텔레콤 유심 정보 유출과 관련해 아직 피해 사례는 없다. 휴대폰 번호와 유심 인증키가 유출됐지만, 주민등록번호나 계좌번호 등 고유식별정보는 포함되지 않았다. 분쟁조정위가 실질적 피해 입증 없이 1인당 30만원의 정신적 손해배상금을 권고한 것에 대해 과도하다는 비판이 나오는 이유다.일각에선 자율적인 분쟁 해결을 목표로 도입된 제도가 ‘정서적 위로금’으로 변질됐다는 비판도 제기된다. 통신업계에선 구체적 피해가 없는 사안에서 고액 조정이 반복되면 제도가 사실상 ‘징벌적 손해배상’의 기능으로 변모할 수 있다며 우려의 목소리를 내고 있다.SK텔레콤은 유심 정보 해킹 사고 직후 약 1조원을 들여 위약금 면제, 데이터 무상 제공, 보안 투자 확대 등의 선제 조치를 취했다. 분쟁조정위는 “SK텔레콤이 즉시 유출 경로를 차단하고 개인정보 악용 방지를 위해 유심 교체 등의 조치를 하는 등 개인정보 침해행위는 중지된 것으로 판단했다”고 인정하면서도 정신적 피해를 들어 고액 배상을 권고했다.다만 개인정보 보호를 강화하기 위해 ‘정보통신망 이용촉진 및 정보보호 등에 관한 법률’의 취지를 개정해야 한다는 목소리도 나온다. 과학기술정보통신부 관계자는 “통신사 같은 대기업조차 기본적인 보안 매뉴얼을 지키지 않는 경우가 이번 조사에서 여러 차례 발견됐다”며 “정보통신망법은 통신사를 해킹 피해자로 규정하고 있는데, 이를 개인정보 보호와 관련한 법률과 조화시킬 방안을 찾을 필요가 있다”고 말했다.","정신적 손해배상 부작용 우려업계 ""피해 입증 없이 돈 주는 격""자율적 개선 노력 위축 가능성SKT는 조정안 수용 불가 입장유심(USIM) 정보 유출로 SK텔레콤에 부과된 1인당 30만원의 정신적 손해배상 권고안을 두고 논란이 불거지고 있다. 개인정보분쟁조정위원회가 분쟁 신청을 받아들인 인원은 3998명뿐이지만, SK텔레콤이 이를 수용할 경우 줄소송에 휘말릴 수 있어서다. 통신업계에선 이번 조정안이 기업의 자율적 개선 노력을 위축시키는 ‘역인센티브’로 작용할 수 있다는 우려가 나온다.18일 업계에 따르면 SK텔레콤은 20일 마감인 조정안 수용 여부와 관련해 ‘불가’ 입장을 고수하고 있는 것으로 알려졌다. 3998명에게 지불할 보상금은 11억9940만원에 불과하지만, 이로 인해 분쟁조정 신청이 쇄도할 가능성이 ...",https://n.news.naver.com/article/newspaper/015/0005212962?date=20251119,경영,0.000600751,0,1,
동아일보,"[박중현 칼럼]李 ‘합리적 실용주의’, 정책 조급증이 망친다","5,000피 속도전이 초래한 ‘빚투’ 발언집값 서둘러 잡으려다 통계조작 논란산업계 반대에도 탄소중립 목표 과속성급한 정책 조장(助長) 부작용 클 것역사상 가장 드라마틱한 주가 예측 실패 사례로 기록된 인물은 1920년대 미국 예일대의 자랑이었던 ‘계량경제학의 창시자’ 어빙 피셔 교수다. 주식투자자로도 유명했던 그는 1929년 10월 투자자들 모임에 참석해 “이제 주가는 영원히 떨어지지 않을 고원(高原)에 이르렀다”는 유명한 말을 남겼다. 그로부터 열흘 뒤 다우존스평균주가가 하루 만에 30% 이상 폭락했는데, 바로 대공황의 시작을 알린 ‘검은 목요일’이었다. 한 달 후에도 그는 주위 사람들에게 “회복이 머지않았다”고 장담했는데, 그로부터 3년간 주가는 10분의 1로 떨어졌다.권대영 금융위원회 부위원장이 이달 초 “빚투도 레버리지의 일종”이란 발언으로 곤욕을 치렀다. 코스피가 4,221.87의 사상 최고가를 찍은 다음 날인 4일 라디오에 나와 “그동안 빚투를 너무 부정적으로만 봤다” “(코스피 5,000은) 당연히 가능하다”고 했다. 당일 2.37% 하락을 시작으로 주가는 보름째 요동치며 투자자의 불안감을 키우고 있다. ‘무리한 투자를 말려야 할 사람이 빚투를 부추겼다’는 야당 의원들의 질책에 그는 결국 국회에서 사과해야 했다.주가 예단의 함정을 잘 아는 금융 관료가 자신의 실수가 경제 교과서에 ‘박제’될 위험을 감수하며 선 넘는 발언을 한 건 이재명 정부의 ‘코스피 5,000 공약’을 빼고 설명할 수 없다. 주가가 정책목표가 되면서 정권 향배의 영향을 많이 받는 공무원 영혼 안의 ‘위기회로’가 멈추고, ‘희망회로’만 작동했을 거란 해석이 가능하다. 미국 금융계의 인공지능(AI) 과잉투자에 대한 우려, 고환율을 피하기 위한 외국인의 증시 이탈 가능성이 눈에 제대로 들어왔을 리가 없다.이런 정책 조급증은 다른 분야에서도 확인된다. 지난달 서울 전 지역과 경기 12개 핵심 지역을 ‘3중 규제’로 묶은 국토교통부의 ‘10·15 대책’ 관련 통계조작 논란이 그렇다. 대책 발표 이틀 전 9월분 집값 통계를 한국부동산원에서 받고도 상승률이 높은 6∼8월 통계를 근거로 규제지역을 확대한 게 문제다. 9월 통계가 반영됐다면 서울 은평·도봉·중랑구 등 집값이 떨어진 다수 지역이 대출 제한 등의 규제를 피할 수 있었다.공식 통계 공표 일자가 15일이고, 하루 전 대책이 결정돼 어쩔 수 없었다는 국토부 변명이 궁색하게 들리는 건 “하루 늦춰 ‘10·16 대책’을 내놓을 순 없었나”라는 반론이 더 설득력이 있어서다. 집값 상승세가 인접 지역으로 번지는 ‘풍선효과’를 어떻게든 막아야 한다는 의욕 과잉이 낳은 사달로 보인다. 개혁신당이 제기한 행정소송에 대해 김윤덕 국토부 장관은 “만약에 진다면 (해당지역 규제 해제는) 당연하다고 생각한다”고 실토할 수밖에 없었다.환경 정책의 과속은 더 심하다. 정부는 최근 ‘2035 국가온실가스 감축목표(NDC)’를 확정해 발표했는데 2018년 배출량 대비 최소 53%, 최대 61%를 줄이는 내용이다. ‘세계 6위 제조업 강국’ 위상을 유지하려면 48%를 넘겨선 안 된다는 산업계 호소를 한참 뛰어넘는 것이어서 충격을 줬다. 전기요금 인상, 막대한 탄소 저감 투자가 불가피해 향후 10년 이상 이어질 대미 투자, 중국과의 치열한 경쟁 속에서 기업들이 버텨내기 어렵게 됐다.이 안건을 국무회의에서 통과시키면서 이 대통령은 “일부 고통이 따르더라도 지속 가능한 성장, 글로벌 경제 강국으로의 도약을 위해 반드시 가야 할, 정말로 피할 수 없는 길”이라고 했다. 문재인 대통령이 2021년 온실가스 40% 감축목표가 담긴 ‘2030 NDC’를 발표할 때 “매우 도전적인 과제이지만, 반드시 가야 할 길”이라고 한 것과 판박이다. 실제로는 탄소중립을 주도해 온 유럽연합(EU)에서 성장의 발목을 잡는 온실가스 목표를 재조정해야 한다는 목소리가 커지고 있고, 미국은 아예 파리기후협약에서 탈퇴했다. ‘합리적 실용주의’를 표방하는 정부라 뭐 하나라도 다르길 기대했던 기업들의 실망이 클 수밖에 없다.대선 공약은 5년 안에 달성하면 되는 목표다. 후유증이 클 2030세대의 빚투까지 부추기며 당장 코스피를 5,000 선까지 끌어올릴 이유가 없다. 정부 부동산 정책에 대한 평가는 규제를 하루 이틀 먼저 하느냐가 아니라, 5년 내내 얼마나 착실히 아파트를 지어 공급하느냐에 달렸다. ‘잠재 성장률 제고’를 최고 목표로 하는 정부라면 환경주의자들의 근본주의적 주장보다 기업들의 합리적 요청에 더 귀를 기울여 과속을 막았어야 했다.벼가 빨리 자랐으면 하는 조바심에 모를 끌어올리다가 농사를 망친 송나라 농부 이야기에서 나온 말이 조장(助長)이다. 주식·부동산·환경·노동 등 정책 전반에서 이런 조짐이 나타나고 있다. 현 정부 임기는 아직 10분의 1도 지나지 않았다. 한미 관세협상을 어렵게 끝낸 이 대통령이 “우리가 가진 최대의 무기는 버티는 것”이라고 했는데, 다른 경제 정책에선 그런 참을성을 찾아보기 어려워 걱정이다.","5,000피 속도전이 초래한 ‘빚투’ 발언집값 서둘러 잡으려다 통계조작 논란산업계 반대에도 탄소중립 목표 과속성급한 정책 조장(助長) 부작용 클 것역사상 가장 드라마틱한 주가 예측 실패 사례로 기록된 인물은 1920년대 미국 예일대의 자랑이었던 ‘계량경제학의 창시자’ 어빙 피셔 교수다. 주식투자자로도 유명했던 그는 1929년 10월 투자자들 모임에 참석해 “이제 주가는 영원히 떨어지지 않을 고원(高原)에 이르렀다”는 유명한 말을 남겼다. 그로부터 열흘 뒤 다우존스평균주가가 하루 만에 30% 이상 폭락했는데, 바로 대공황의 시작을 알린 ‘검은 목요일’이었다. 한 달 후에도 그는 주위 사람들에게 “회복이 머지않았다”고 장담했는데, 그로부터 3년간 주가는 10분의 1로 떨어졌다.권대영 금융위원회 부위원장이 이달 ...",https://n.news.naver.com/article/newspaper/020/0003675415?date=20251119,경영,0.000581943,0,3,
동아일보,"김환기 1971년작 점화, 美서 123억에 낙찰",뉴욕 크리스티 경매서 팔려한국 미술품 역대 2번째 금액국내 추상미술의 선구자로 꼽히는 화가 김환기(1913∼1974)의 전면점화(全面點畫)가 미국 경매에서 한국 현대 미술품 경매 사상 두 번째로 높은 금액인 840만 달러(약 123억 원)에 낙찰됐다.경매회사 크리스티에 따르면 17일(현지 시간) 미국 뉴욕에서 열린 ‘20세기 이브닝 세일’에서 김환기의 1971년작 ‘19-VI-71 #206’이 낙찰됐다. 구매자는 수수료를 포함하면 약 151억 원을 지불해야 한다.이는 한국 미술품의 역대 최고 낙찰가 기록을 갖고 있는 김환기의 ‘우주’(05-IV-71 #200)에 이어 두 번째로 높은 가격이다. ‘우주’는 2019년 홍콩 경매에서 약 132억 원에 팔렸다. 역대 3위도 김환기의 작품이다. 또 다른 전면점화인 ‘3-II-72 #220’(1972년)은 2018년 서울옥션 홍콩 경매에서 85억3000만 원에 낙찰됐다.‘19-VI-71 #206’은 우주로 팽창하는 듯한 무한한 공간감을 점으로 표현한 작품이다. 가로 254cm에 세로 203cm의 큰 캔버스에 그려 넣은 대작이다.,뉴욕 크리스티 경매서 팔려한국 미술품 역대 2번째 금액국내 추상미술의 선구자로 꼽히는 화가 김환기(1913∼1974)의 전면점화(全面點畫)가 미국 경매에서 한국 현대 미술품 경매 사상 두 번째로 높은 금액인 840만 달러(약 123억 원)에 낙찰됐다.경매회사 크리스티에 따르면 17일(현지 시간) 미국 뉴욕에서 열린 ‘20세기 이브닝 세일’에서 김환기의 1971년작 ‘19-VI-71 #206’이 낙찰됐다. 구매자는 수수료를 포함하면 약 151억 원을 지불해야 한다.이는 한국 미술품의 역대 최고 낙찰가 기록을 갖고 있는 김환기의 ‘우주’(05-IV-71 #200)에 이어 두 번째로 높은 가격이다. ‘우주’는 2019년 홍콩 경매에서 약 132억 원에 팔렸다. 역대 3위도 김환기의 작품이다. 또 다른 전면점화인 ...,https://n.news.naver.com/article/newspaper/020/0003675535?date=20251119,기타,0.000578933,0,0,
중앙일보,"“김정은 정말 불쾌, 악랄하다…북핵 문제는 중국이 해결해야”",도널드 트럼프 1기 행정부 때 미국의 외교안보 정책을 총괄한 마이크 폼페이오(사진) 전 국무장관이 17일(현지시간) 북·미 정상회담 재개 가능성에 대해 “특별히 높지 않다고 생각한다”며 회의적인 태도를 보였다.폼페이오 전 장관은 이날 워싱턴 DC 인근 발로파크 콘퍼런스룸에서 법무법인 대륙아주가 주최한 공개 대담에서 “김정은(북한 국무위원장)이 바라는 것은 경제적 구제책과 정상국가로 인정받는 것이겠지만 실현할 도구가 없다. 일본·한국·호주·미국·영국 등을 설득할 만한 어떤 것도 제시하지 않았다”고 말했다. 북한이 핵프로그램과 재래식 무기 축적이 계속되는 상황에서 북한과의 관계 정상화 가능성은 거의 제로(0)에 가깝다고도 했다.폼페이오 전 장관은 “김정은은 정말 불쾌한 인물”이라며 “무례하다는 게 아니라 악랄하다는 뜻이다. 그는 한반도가 자신의 것이라고 믿는다”고 말했다. 또 트럼프 1기 때 북·미 정상회담에 대해 “솔직히 성공하지 못했다. 그들(북한)은 여전히 핵무기 프로그램을 보유하고 있다”고 평가했다. 폼페이오 전 장관은 북한 핵문제는 중국이 해결해야 한다고 말했다. 그는 “김정은은 싱가포르·하노이·판문점 등 매번 회담 전후로 베이징에 보고했다. 우리가 협상한 상대는 사실상 시진핑(중국 국가주석)이었다”며 김정은은 핵무기 문제를 단독으로 결정할 자유가 없고 한국과 관련된 대부분 사안을 시 주석에 의존하고 있다고 말했다.폼페이오 전 장관은 “한국은 원자력추진잠수함(원잠)이 필요한가”라는 물음에 “내 답은 간단하다. 예스(Yes)”라며 “원잠은 한국에 필요하다”고 말했다. 이어 “이 문제(한국 원잠 승인)는 당파적 사안이 아니다. 달성 가능한 목표”라며 미 의회 동의도 낙관했다.,도널드 트럼프 1기 행정부 때 미국의 외교안보 정책을 총괄한 마이크 폼페이오(사진) 전 국무장관이 17일(현지시간) 북·미 정상회담 재개 가능성에 대해 “특별히 높지 않다고 생각한다”며 회의적인 태도를 보였다.폼페이오 전 장관은 이날 워싱턴 DC 인근 발로파크 콘퍼런스룸에서 법무법인 대륙아주가 주최한 공개 대담에서 “김정은(북한 국무위원장)이 바라는 것은 경제적 구제책과 정상국가로 인정받는 것이겠지만 실현할 도구가 없다. 일본·한국·호주·미국·영국 등을 설득할 만한 어떤 것도 제시하지 않았다”고 말했다. 북한이 핵프로그램과 재래식 무기 축적이 계속되는 상황에서 북한과의 관계 정상화 가능성은 거의 제로(0)에 가깝다고도 했다.폼페이오 전 장관은 “김정은은 정말 불쾌한 인물”이라며 “무례하다는 게 아니라 악랄하...,https://n.news.naver.com/article/newspaper/025/0003483651?date=20251119,경영,0.000572002,0,1,
매일경제,"새마을금고 ""최악은 지났다"" … 소비자보호 등 신뢰회복 나서","외부 컨설팅 잇따라 의뢰부실채권 정리에도 박차위기의 터널을 지나고 있는 새마을금고가 감독 체계 정비 및 건전성 제고에 나섰다. 뼈를 깎는 자구 노력을 통해 고객들에게 확실한 믿음을 주는 새마을금고로 재탄생하겠다는 각오다.18일 금융권에 따르면 새마을금고중앙회는 최근 금융소비자보호법(금소법) 적용에 대비해 컨설팅 용역을 공고했다.대통령실과 더불어민주당에서 새마을금고를 비롯한 상호금융권도 금소법 관리 대상에 넣어야 한다는 목소리가 커지고 관련 법안도 발의되자 선제적으로 대비에 나선 것이다.김현정 더불어민주당 의원은 지난 8월 새마을금고를 비롯해 농협·수협·산림조합 등도 금소법 적용 대상으로 삼도록 하는 금소법 개정안을 발의했다.금소법이 적용되면 금융 상품을 판매할 때 청약철회권·계약해지권 등 소비자 권리를 더 적극적으로 보장해야 한다. 또 금융분쟁조정, 실태평가, 자체 검사 업무 등 내부통제 의무가 강화된다. 이에 맞춘 조직 개편, 인력 증원·조정, 내부통제 시스템 개편 등이 필요한 상황이다.지난 9월 예금보호한도가 늘어남에 따라 자체 예금자보호준비금 한도 상향에도 나섰다. 이를 위해 새마을금고는 외부 기관에 적정 예보준비금 수준과 예금보험료율 산정을 위한 컨설팅을 맡긴 것으로 알려졌다.지난해 말 새마을금고의 예보준비금은 2조6691억원으로 적립률(1.14%)이 목표 적립률 하한인 1.28%에도 미치지 못했다. 이에 예보준비금 추가 충당에 나서는 한편 용역 결과를 토대로 내년 초 적정 준비금과 예보료율 인상을 확정할 방침이다.부실채권 정리에도 속도를 낸다. 올해 말부터는 새마을금고가 설립한 부실채권 관리회사인 '새마을금고자산관리회사'가 신용정보법 개정에 따라 신용정보제공자 겸 신용정보이용자에 포함된다. 이에 따라 새마을금고자산관리회사가 법원 개인회생 사건에서 변제 정보나 주택임대차 보증금을 반환하지 않은 자의 정보를 직접 수집할 수 있을 전망이다.[안정훈 기자]",외부 컨설팅 잇따라 의뢰부실채권 정리에도 박차위기의 터널을 지나고 있는 새마을금고가 감독 체계 정비 및 건전성 제고에 나섰다. 뼈를 깎는 자구 노력을 통해 고객들에게 확실한 믿음을 주는 새마을금고로 재탄생하겠다는 각오다.18일 금융권에 따르면 새마을금고중앙회는 최근 금융소비자보호법(금소법) 적용에 대비해 컨설팅 용역을 공고했다.대통령실과 더불어민주당에서 새마을금고를 비롯한 상호금융권도 금소법 관리 대상에 넣어야 한다는 목소리가 커지고 관련 법안도 발의되자 선제적으로 대비에 나선 것이다.김현정 더불어민주당 의원은 지난 8월 새마을금고를 비롯해 농협·수협·산림조합 등도 금소법 적용 대상으로 삼도록 하는 금소법 개정안을 발의했다.금소법이 적용되면 금융 상품을 판매할 때 청약철회권·계약해지권 등 소비자 권리를 더 ...,https://n.news.naver.com/article/newspaper/009/0005592250?date=20251119,기타,0.000570156,0,0,
동아일보,"[사설]“한반도, 중-러 억제 중심축”… 한국이 美 발진기지 될 순 없다","제이비어 브런슨 주한미군사령관이 17일 위아래를 뒤집어 그린 동아시아 지도를 공개하면서 한국이 북한뿐 아니라 중국, 러시아의 위협을 억제할 전략적 중심축이라고 밝혔다. 그간 북한 방어에 맞췄던 주한미군의 핵심 역할이 중-러를 군사적으로 압박하는 방향으로 바뀌고 있다고 분명히 한 것이다. 실제 브런슨 사령관은 주한미군이 서해에서 중국 육해공군, 동해에서 러시아 함대를 견제할 수 있다는 구체적 방안까지 언급했다.이 발언은 한미 정상회담 결과를 담은 팩트시트에 ‘한미 양국이 모든 역내 위협에 대한 미국의 억제 태세를 강화할 것’이라고 명시한 지 사흘 만에 나왔다. 미국은 군사 전략의 최우선 목표를 중국 억제에 두는 새 국가방위전략(NDS), 전 세계 미군을 어디에 배치할지 결정하는 글로벌태세보고서(GPR) 발표를 앞두고 있다. 그에 따라 주한미군의 전략적 유연성 확대에 협조하라는 미국의 요구가 한층 더 거세질 수 있음을 예고한 셈이다.더욱이 브런슨 사령관은 ‘베이징의 관점에서 보면 주한미군의 오산 공군기지가 원거리 위협이 아니라 중국에 즉각 영향을 주는 인접한 위협’이라고 했다. 대만 유사시처럼 미국이 필요한 때에 중국을 직접 겨냥한 발진 기지로 한반도를 활용할 수 있다는 뜻이나 다름없다. 한국이 미중 간 군사적 충돌에 휘말릴 수 있는 중대한 상황을 주한미군사령관이 아무렇지도 않게 언급한 것은 우려하지 않을 수 없다.물론 주한미군을 지휘하는 그가 전 세계 미군의 재배치를 앞두고 주한미군 감축을 막으려 전략적 중요성을 강조한 것일 수도 있다. 하지만 어떤 경우든 우리 안보에 직접 영향을 미칠 사안은 한미 간 긴밀한 사전 협의가 필요하다. 이런 과정 없이 한국이 중국의 잠재적 공격 표적이 되는 위험을 감수하는 일이 생겨선 안 된다.미중 패권 경쟁과 지정학적 안보 환경의 변화에 따라 한미 동맹의 범위가 조정되는 것은 피할 수 없는 흐름이다. 미 당국자들은 한국이 중국에 대한 군사적 억제에 기여해야 한다고 공공연히 말하고 있다. 그럴수록 한미 동맹을 근간으로 하되 중국과 대립하지 않겠다는 실용외교는 더욱 고난도의 시험대에 설 것이다. 미국의 NDS, GPR 발표까지 기다릴 여유가 없다. 지금부터 주한미군 역할에 대한 우리의 마지노선을 분명히 제시해야 한다. 미국이 이를 넘지 않도록 확실히 설득하면서도 동맹의 마찰을 최소화해 내는 것이야말로 진짜 외교 역량이 될 것이다.","제이비어 브런슨 주한미군사령관이 17일 위아래를 뒤집어 그린 동아시아 지도를 공개하면서 한국이 북한뿐 아니라 중국, 러시아의 위협을 억제할 전략적 중심축이라고 밝혔다. 그간 북한 방어에 맞췄던 주한미군의 핵심 역할이 중-러를 군사적으로 압박하는 방향으로 바뀌고 있다고 분명히 한 것이다. 실제 브런슨 사령관은 주한미군이 서해에서 중국 육해공군, 동해에서 러시아 함대를 견제할 수 있다는 구체적 방안까지 언급했다.이 발언은 한미 정상회담 결과를 담은 팩트시트에 ‘한미 양국이 모든 역내 위협에 대한 미국의 억제 태세를 강화할 것’이라고 명시한 지 사흘 만에 나왔다. 미국은 군사 전략의 최우선 목표를 중국 억제에 두는 새 국가방위전략(NDS), 전 세계 미군을 어디에 배치할지 결정하는 글로벌태세보고서(GPR) 발표를...",https://n.news.naver.com/article/newspaper/020/0003675418?date=20251119,기타,0.000569721,0,0,
