신문사,제목,본문,본문_요약,링크,카테고리,예측점수,업계_키워드_개수,경영_키워드_개수,최종선택여부
조선일보,반도체 수퍼사이클 뒤엔 ‘칩플레이션’ 온다,"메모리 반도체 수요와 가격이 폭등하는 ‘수퍼사이클(초호황)’에 진입하면서 국내 대표 반도체 제조사인 삼성전자와 SK하이닉스는 전례 없는 실적을 기록할 것으로 전망된다. 하지만 메모리 칩(chip) 가격이 뛰는 이면에는 PC·스마트폰 같은 전자제품 가격도 뒤따라 오르는 ‘칩플레이션(반도체를 의미하는 칩과 인플레이션 합성어)’ 우려도 함께 커지고 있다. 인공지능(AI) 열풍으로 내년에도 메모리 칩 품귀 현상이 지속할 것이라는 예측이 나오는 가운데, 중소형 전자기기 제조사의 비용 부담이 커지고, 이는 전자제품 가격 인상 압박 요인으로 작용할 것으로 예상된다. 이는 IT 소비 시장 전반의 수요 둔화로 이어질 수도 있다는 우려가 나온다.PC용 D램 가격 3배로PC를 조립할 때 반드시 들어가는 메모리 칩 가격은 무섭게 치솟고 있다. IT 기기 가격 비교 사이트 다나와에 따르면, 소비자용 D램인 삼성전자 DDR5-5600 16기가바이트(GB) 제품 가격은 지난 9월 6만9246원 수준에서 18일 현재 20만8090원으로 급등했다. 두 달 사이 3배로 오른 것이다. 낸드플래시 가격도 오름세다. SK하이닉스의 1테라바이트(TB) SSD 제품 가격은 같은 기간 15만6680원에서 19만5000원으로 24% 올랐다.범용 메모리 칩 가격 상승의 배경에는 AI 열풍이 있다. 메모리 업체들은 AI 가속기에 들어가는 고대역폭 메모리(HBM) 생산을 늘렸고, 이로 인해 소비자용 메모리 공급은 후순위가 됐다. 범용 D램과 낸드플래시가 품귀 현상을 겪게 됐고, 메모리 칩과 전자기기 가격 상승으로 이어졌다. 샤오미가 지난달 출시한 스마트폰 레드미 K90 프로 맥스 모델은 3999위안(약 82만원)으로, 전작 대비 6만원가량 가격이 올랐다. 소비자 반발이 커지자 루웨이빙 샤오미 최고경영자(CEO)는 “원가 압박이 신제품 가격 인상으로 이어졌다”며 “메모리 칩 가격 상승은 예상을 훨씬 뛰어넘고 있으며, 더욱 심화할 수 있다”고 했다. 테크 업계 관계자는 “삼성전자와 애플도 내년 출시할 신제품의 가격을 동결하기는 쉽지 않을 것”이라고 했다.원가 상승으로 전자기기 소비자 시장이 침체할 것이라는 우려도 나온다. 17일 시장조사 업체 트렌드포스는 내년 스마트폰 생산량이 올해보다 2% 줄어들고, 노트북 생산량도 2.4% 감소할 것으로 추산했다. 트렌드포스는 “올해 4분기 D램 계약 가격은 75% 이상 상승할 것으로 예상되며, D램과 낸드플래시 가격 상승은 계속될 것”이라며 “2026년에는 스마트폰 제조 원가가 올해 대비 5~7% 이상 증가할 것으로 전망된다”고 했다. 노트북 역시 메모리 가격 급등으로 원가가 올해보다 10~12% 상승할 것으로 예상된다. 스마트폰과 노트북 가격은 10% 안팎 오를 수 있다는 전망이다. 이로 인해 가격이 중요한 보급형 시장에서 수요가 강하게 위축될 수 있다는 분석이 나온다.메모리 부족 장기화더 큰 문제는 이런 메모리 부족이 장기화할 가능성이 크다는 것이다. 당장 생산 능력을 늘리기도 어려운 데다, 메모리 업체들의 추가 투자도 HBM 등 단가가 높은 메모리 라인으로 집중되고 있기 때문이다. 트렌드포스는 글로벌 D램의 재고 회전 일수가 3.3주로 떨어진 것으로 추산했다. 김동원 KB증권 연구원은 “2026~2027년 D램 시장은 심각한 공급 부족에 직면하고, 낸드플래시는 공급 축소 전략으로 생산 능력 감소가 예상된다”며 “최근에는 AI 데이터센터 수요 증가와 일반 서버의 교체 수요가 동시에 발생하면서 메모리의 공급 부족과 가격 상승 장기화는 불가피할 전망”이라고 했다.","메모리 반도체 수요와 가격이 폭등하는 ‘수퍼사이클(초호황)’에 진입하면서 국내 대표 반도체 제조사인 삼성전자와 SK하이닉스는 전례 없는 실적을 기록할 것으로 전망된다. 하지만 메모리 칩(chip) 가격이 뛰는 이면에는 PC·스마트폰 같은 전자제품 가격도 뒤따라 오르는 ‘칩플레이션(반도체를 의미하는 칩과 인플레이션 합성어)’ 우려도 함께 커지고 있다. 인공지능(AI) 열풍으로 내년에도 메모리 칩 품귀 현상이 지속할 것이라는 예측이 나오는 가운데, 중소형 전자기기 제조사의 비용 부담이 커지고, 이는 전자제품 가격 인상 압박 요인으로 작용할 것으로 예상된다. 이는 IT 소비 시장 전반의 수요 둔화로 이어질 수도 있다는 우려가 나온다.PC용 D램 가격 3배로PC를 조립할 때 반드시 들어가는 메모리 칩 가격은 무섭게...",https://n.news.naver.com/article/newspaper/023/0003941702?date=20251119,경영,0.989901851,0,3,1
한국경제,[김보형의 재계 인사이드] '국익 지켜낸 협상'이 빛을 보려면,"김보형 산업부 차장“신발 끈을 다시 고쳐 매고 뛴다는 마음으로 기술 개발에 힘써야죠.”엔진 점화 부품을 생산해 현대자동차는 물론 미국 제너럴모터스(GM), 포드 등에 납품하는 A사 대표의 표정은 밝았다. 지난 14일 한·미 양국이 ‘조인트 팩트시트’를 통해 25%이던 자동차·부품 관세를 15%로 내려서다. 이 회사는 매년 600억원어치 부품을 미국에 수출한다. 매출의 30%에 이른다. 관세 타결이 늦어졌다면 연간 관세로만 150억원을 내야 하는 상황이었다. 지난해 영업이익(130억원)을 웃도는 만큼 적자 기업으로 전락할 처지였다. 15%로 떨어져도 연 90억원의 관세를 내야 하지만 A사 대표는 “일본, 유럽 경쟁사보다 불리하지 않은 조건이니 해볼 만하다”고 했다.韓 전기차 '마더팩토리'로한·미 관세 협상 타결로 한국 자동차산업을 짓누르던 먹구름이 걷혔다. 작년 생산유발액 321조원으로 국내 수출 1위 품목인 자동차산업은 지난 4월(자동차)과 5월(차 부품)부터 이어진 미국의 25% 관세 여파로 시련을 겪었다. 현대차그룹이 올해 3분기까지 떠안은 관세만 4조6000억원에 달한다. 100대 상장 자동차 부품사의 2분기 영업이익은 전년보다 10% 넘게 줄었다.관세 협상 타결까지 한·미 양국은 23차례 장관급 회담과 수십 차례 실무 협의를 벌였다. 3500억달러 대미 투자펀드 양해각서(MOU)를 체결하면서 정부는 연간 투자 한도를 200억달러로 한정하고, 20년 안에 투자 원금 상환이 어려우면 수익 배분 비율을 재조정할 수 있는 ‘안전장치’를 받아냈다. “국익을 지켜낸 협상”이란 평가가 나오는 이유다.관세 불확실성이 해소되자 자동차업계 맏형인 현대차그룹은 2030년까지 125조2000억원을 국내에 쏟아붓는 투자 보따리로 화답했다. 기아는 팩트시트 발표 직후 경기 화성 ‘이보(EVO) 플랜트’에 연 15만 대를 생산할 수 있는 전기자동차 공장 착공식을 열었다. 같은 날 준공한 연 10만 대 공장과 합치면 25만 대 규모 전기차 공장을 국내에 들여놓기로 한 것이다. 현대차도 전기차(연 20만 대)와 수소연료전지(연 3만 기) 등 미래모빌리티 신공장을 울산에 짓고 있다.일각에서 제기한 ‘미국 투자 확대에 따른 국내 제조업 공동화 우려’를 없앤 것이다. 현대차그룹이 국내 공장을 제품 개발·제조의 핵심인 ‘마더팩토리’로 만들기로 한 만큼 향후 해외에 공장을 추가로 짓더라도 제조 허브로서 한국의 위상엔 변화가 없다. 현대차그룹은 여기에 더해 올해 1차 협력사가 부담한 수천억원 규모의 대미 자동차 부품 관세도 전액 보전해주기로 했다.관세 인하 소급 적용 서둘러야먹구름이 걷힌 만큼 다시 신발 끈을 조여 매야 할 때지만 우리 자동차업계는 생각지도 못한 복병에 다시 한숨을 쉬고 있다. 팩트시트 국회 비준 여부를 놓고 정치권이 공방을 벌이면서 관세 인하 적용 시점이 또다시 지연될 가능성이 생겨서다. 정부와 여당은 팩트시트가 국가 간 조약이 아니라 양해각서(MOU)로 국회 비준 동의 대상이 아닌 만큼 대미 투자 특별법을 제정해 처리하자고 주장했다. 야당은 대미 투자에 따른 재정적 부담을 이유로 국회의 비준 동의가 필요하다고 맞섰다.자동차업계의 속은 타들어 간다. 한·미 양국은 관세 인하 시점을 한국이 대미 투자 특별법을 국회에 제출한 달의 1일로 소급 적용하기로 했다. 대미 투자 특별법이 이달 제출되면 11월 1일부터, 다음달 제출되면 12월 1일부터 인하되는 식이다. 법안 제출이 이달을 넘기면 자동차업계는 4000억원을 추가로 떠안아야 한다. 정치권의 공방이 길어질수록 기업이 피해를 보는 구조다.자동차산업은 국내총생산(GDP) 기여도 1위다. 무려 14%에 달한다. 고용 측면에서도 1위다. 전체의 7%에 해당하는 150만여 명을 직간접적으로 고용한다. 자동차 생태계가 흔들리면 한국 경제가 온전하게 달릴 수 없는 구조다. 국익을 생각한다면 지금 국회가 논의해야 할 사안은 ‘형식’이 아니라 ‘실질’이어야 한다.","김보형 산업부 차장“신발 끈을 다시 고쳐 매고 뛴다는 마음으로 기술 개발에 힘써야죠.”엔진 점화 부품을 생산해 현대자동차는 물론 미국 제너럴모터스(GM), 포드 등에 납품하는 A사 대표의 표정은 밝았다. 지난 14일 한·미 양국이 ‘조인트 팩트시트’를 통해 25%이던 자동차·부품 관세를 15%로 내려서다. 이 회사는 매년 600억원어치 부품을 미국에 수출한다. 매출의 30%에 이른다. 관세 타결이 늦어졌다면 연간 관세로만 150억원을 내야 하는 상황이었다. 지난해 영업이익(130억원)을 웃도는 만큼 적자 기업으로 전락할 처지였다. 15%로 떨어져도 연 90억원의 관세를 내야 하지만 A사 대표는 “일본, 유럽 경쟁사보다 불리하지 않은 조건이니 해볼 만하다”고 했다.韓 전기차 '마더팩토리'로한·미 관세 협상 타...",https://n.news.naver.com/article/newspaper/015/0005213118?date=20251119,경영,0.981337845,0,2,
매일경제,AI칩 만드느라 D램·낸드 뒷전 … 빅테크 사재기 겹쳐 '품귀' 예고,"AI發 반도체가격 급등삼성·하이닉스 HBM 늘리자휴대폰·PC D램 공급난 심화PC제조 기업 델·HP 직격탄내년 PC 가격 15%급등 전망K칩 부족 파고드는 中中스마트폰 기업 칩부족 겪자YMTC, 생산역량 확대 나서""中 기업만 반사이익 입을 것""메모리 반도체 가격 상승에 따라 전자제품 전반의 가격이 오르는 '칩플레이션'은 인공지능(AI) 인프라 투자 붐으로 메모리 반도체 업체들이 고대역폭메모리(HBM) 생산에 집중하면서 생긴 현상이다. 생산능력의 상당 부분을 HBM 생산에 배정하면서 PC, 서버, 스마트폰 등에 들어가는 D램 공급이 줄어들자 가격이 오르고 있는 것이다. AI 데이터센터에 들어가는 저장장치 수요가 급증하면서 낸드플래시 가격도 함께 오르고 있다. 로이터통신은 지난 14일 소식통을 인용해 삼성전자의 일부 메모리 칩 가격이 올 9월 대비 최대 60% 상승했다고 보도했다.주요 전자제품에 들어가는 로직 반도체를 생산하는 TSMC가 가격을 인상한 것도 시장에 충격을 더하고 있다. TSMC는 갤럭시 스마트폰에 들어가는 퀄컴 AP, 아이폰에 들어가는 애플 AP를 생산한다. AMD, 엔비디아를 위한 중앙처리장치(CPU)와 그래픽처리장치(GPU)도 생산한다.이 같은 반도체 가격 인상은 완성제품을 만드는 기업들의 수익 악화와 판매량 감소로 이어질 가능성이 크다. 17일(현지시간) 모건스탠리는 PC와 서버 제조가 주 사업인 델에 대한 투자의견을 '비중 확대'에서 '비중 축소'로 두 단계 강등시켰다. D램과 낸드의 가격 상승이 델의 수익성을 낮출 수 있다는 판단에 따른 것이다. 델은 메모리 조달률이 40%까지 떨어질 수 있다는 전망을 내놨다. 메모리 공급 부족으로 제때 제품을 공급하지 못할 수도 있다는 것이다. 이날 델 주가는 8.43%, HP 주가는 6.7% 급락했다.트렌드포스는 메모리 반도체 가격 상승이 전자제품 가격 상승으로 이어져 전자제품 소비가 전반적으로 줄어들 것이라는 전망을 내놨다. 트렌드포스는 내년 스마트폰 전체 부품 원가가 5~7% 이상 상승해 이 중 상당 부분이 소비자가격에 전가될 것으로 예상했다. 랩톱은 리테일 시장에서 평균 판매가격이 5~15% 상승할 것으로 전망됐다. 이 같은 가격 상승이 소비 감소로 이어져 2026년 스마트폰 생산량이 올해와 비교해 2%, 랩톱 생산량은 2.4% 줄어들 것이라는 추정이 나왔다. 트렌드포스는 특히 마진이 적은 저가 스마트폰의 타격이 클 것으로 예상했다.메모리 가격의 급격한 상승이 제품 수요 감소로 이어져 다시 메모리 가격 급락으로 이어지는 악순환의 가능성도 있다.메모리 가격이 급등하자 중국을 중심으로 스마트폰 업체들은 조기에 물량을 확보하기 위해 분주해졌다. 중국 테크미디어 36Kr에 따르면 중국 스마트폰 업체들은 메모리를 구하지 못해서 비상이 걸렸다. 이 매체는 현지 관계자의 말을 인용해 ""휴대폰 제조업체의 수요가 아니라 삼성과 SK하이닉스가 얼마나 많은 재고를 할당할 수 있느냐가 중요해졌다""고 설명했다. 중국의 대표적 파운드리인 SMIC는 최근 콘퍼런스콜에서 고객사인 스마트폰 회사들이 내년에 필요한 메모리를 충분히 확보할 수 있을지 우려하고 있다며 이것이 SMIC에 들어오는 주문을 줄이고 있다고 밝혔다.애플 등 빅테크 기업들은 1년 치 메모리 반도체에 대한 장기 계약을 통해 내년 필요 물량을 이미 확보한 것으로 보인다.이 같은 메모리 공급 부족 현상은 삼성전자, SK하이닉스, 마이크론 등 메모리 3강 외 하위권 기업들에는 기회가 될 것으로 예상된다. 특히 중국 메모리 반도체 업체들에 큰 기회가 될 것으로 보인다. 그동안 중국 스마트폰 제조업체들이 삼성전자, SK하이닉스 메모리 반도체를 우선적으로 탑재했는데 공급이 부족하면 중국 업체들의 반도체를 선택할 수 있고, 이것이 중국 메모리 반도체 자급률 확대로 이어질 수 있다는 것이다.니혼게이자이신문(닛케이)에 따르면 중국 최대 낸드플래시 제조업체인 YMTC는 최근 제3공장 건설에 착수하는 등 공격적으로 생산능력을 확대하고 있다. 옴디아에 따르면 YMTC의 자본 지출은 올해 전 세계 낸드플래시 메모리 투자의 약 20%에 달한다. 옴디아가 2년 후 전 세계 낸드플래시 업계 4위로 올라설 것이란 전망도 있다.반도체 업계 관계자는 ""삼성전자와 SK하이닉스의 캐파 확대가 제한적인 상황에서 시장이 커지면 중국 업체들에 기회가 돌아갈 수밖에 없다""면서 ""중국 업체들은 이를 기회로 삼아 시장점유율을 확대할 것""이라고 설명했다. 중국 정부가 이번에도 보조금을 통해 메모리 기업들을 지원할 것이라는 전망 또한 나온다. 이에 따라 국내 반도체 기업들의 중국 팹 역할이 중요해진다는 진단이 있다.중국 내에서 주도권을 유지하기 위해 전략적인 접근이 필요하다는 것이다. 삼성전자는 중국 시안에서 낸드플래시 메모리를 생산하고 있고, SK하이닉스는 중국 장쑤성 우시에서 D램을 생산하고 있다. 시안 공장은 삼성전자 전체 낸드플래시 생산량의 절반, 우시 공장은 SK하이닉스 D램 생산의 40%에 달하는 규모다.[이덕주 기자 / 박민기 기자]","AI發 반도체가격 급등삼성·하이닉스 HBM 늘리자휴대폰·PC D램 공급난 심화PC제조 기업 델·HP 직격탄내년 PC 가격 15%급등 전망K칩 부족 파고드는 中中스마트폰 기업 칩부족 겪자YMTC, 생산역량 확대 나서""中 기업만 반사이익 입을 것""메모리 반도체 가격 상승에 따라 전자제품 전반의 가격이 오르는 '칩플레이션'은 인공지능(AI) 인프라 투자 붐으로 메모리 반도체 업체들이 고대역폭메모리(HBM) 생산에 집중하면서 생긴 현상이다. 생산능력의 상당 부분을 HBM 생산에 배정하면서 PC, 서버, 스마트폰 등에 들어가는 D램 공급이 줄어들자 가격이 오르고 있는 것이다. AI 데이터센터에 들어가는 저장장치 수요가 급증하면서 낸드플래시 가격도 함께 오르고 있다. 로이터통신은 지난 14일 소식통을 인용해 삼성전자의...",https://n.news.naver.com/article/newspaper/009/0005592262?date=20251119,경영,0.978201797,0,1,1
한국경제,"용인에 반도체 新공장 10개…""당장 원전 여러개 지어도 전기부족""","반도체·방산…모든 산업으로 번지는 전력난정부 에너지 수급 계획은 불투명지난달 말 경남 거제 한화오션 조선소에서 진수한 국산 첫 3600t급 잠수함(장보고 Ⅲ-배치Ⅱ-1번함) 장영실함. 재래식 잠수함으로 역대 최고 성능을 갖춘 이 잠수함을 건조하는 데는 ‘전기 먹는 하마’로 불리는 육상기반시험설비(LBTS)가 필수다. 심해에서 30년가량 임무를 수행하는 잠수함의 배터리와 모터 등의 성능을 땅 위에서 검증하는 첨단 설비다. 글로벌 기업 중 제너럴일렉트릭(GE) 정도만 보유하고 있고 국내에는 경남 창원에 단 한 개 있다.창원 LBTS의 전기 소모량은 중대형 아파트 단지 한 곳(약 1000가구)이 쓰는 6메가와트(㎿)다. 한국이 앞으로 미국 추인 아래 핵추진 잠수함을 국내에서 건조한 뒤 전력화하려면 이보다 훨씬 큰 규모의 LBTS가 다수 필요하다. 18일 방산업계 관계자는 “수상정 등 함정의 전동화는 거스를 수 없는 추세”라며 “미래 전쟁에 대비하려면 군 전용 인공지능(AI) 데이터센터가 필수인데 이를 위해서는 원전 등 확실한 기저 발전원이 필수”라고 말했다. 이재명 정부의 전력 공급 청사진은 이런 업계의 수요와 반대로 가고 있다는 지적이 나온다. 정부는 제12차 전력수급기본계획에서 신재생 비중을 상당량 늘릴 것으로 전망된다.방산 등 全 산업으로 확산하는 '전력 수요 쓰나미'경기도 전력망 포화상태…'전기화' 물결 거센 韓 제조업SK하이닉스 공장이 자리한 경기 이천시가 올해 3분기까지 수입한 액화천연가스(LNG)는 65만t으로 작년 같은 기간보다 19% 증가했다. 대당 1.5㎿급의 극자외선(EUV) 노광장비 수십 대에 필요한 전기를 생산하기 위해서다. 포스코그룹의 전력 수요는 지난해 2.9GW에서 2050년 4.6GW로 1.6배 늘어날 것으로 전망된다. 막대한 탄소 배출원인 용광로를 수소환원제철 체제로 전면 전환하는 것이 주된 이유다.에너지업계 관계자는 “폭증하는 인공지능(AI) 전력 수요에 대응할 수 있는 무탄소 기저 에너지원은 아직 원전밖에 없다는 게 주요국의 시각”이라고 말했다. 현재(제11차) 전력수급기본계획에서 발전량 기준 전원은 원전과 석탄화력발전이 31%로 같고 LNG 27%, 신재생 10% 순이다. 1GW짜리 원전은 연간 약 80억㎾h를 생산할 수 있어 동일 규모의 풍력(20억~30억㎾h), 태양광(13억~18억㎾h) 설비보다 단위 시간당 생산량이 월등하다.◇ 경기도 전력망 포화 상태각종 제조 시설이 몰린 경기도의 전력망은 포화 상태다. 18일 전력거래소에 따르면 내년부터 2030년까지 수도권에 있는 모든 변전소를 동원해도 반도체 제조 공장 등의 추가 전력 수요를 충당하기 어렵다. 삼성전자는 경기 용인시에 새 반도체 공장 6개를 건립할 예정이다. 2028년께 공사에 착수해 첫 가동은 2031년으로 예상된다. 용인 반도체 클러스터 조성에 한창인 SK하이닉스는 4개의 신규 공장을 짓는다. 첨단 반도체 공장의 전력 수요가 최대 500㎿인 것을 고려하면 용인에 새로 생기는 10개 공장에만 대형 원전 5개 수준인 5GW 규모의 전력이 필요하다.관세청에 따르면 올해 1~3분기 이천시에 직수입된 발전용 LNG는 총 65만t에 달했다. 이 중 상당량은 고대역폭메모리(HBM)의 심장인 SK하이닉스 이천 사업장 내 570㎿ 규모의 LNG발전소로 향한다. 이 발전소는 지난해에 이어 올해까지 풀가동 중이다. 삼성전자는 2028년부터 용인 클러스터에서 신규 공장 건축을 시작할 것으로 알려졌다. 정부는 이 지역에서 늘어날 전력 수요에 대응하기 위해 3GW 규모의 LNG발전소를 건설하는 방안을 검토 중이다. 하지만 기저 전원 확보 방식과 전력망 구성안은 아직 확정되지 않았다.업계는 2038년까지 신규 데이터센터 전력 수요가 대형 원전 2~3기 상당인 3GW 이상일 것으로 보고 있다. 원전 1기 건립에 최소 15년 이상 걸리는 점을 감안하면 지금부터 지어도 여유가 없다는 얘기다. 하지만 ‘신재생 우선’ 원칙을 내세운 기후환경에너지부는 제11차 전기본에 명시된 2.8GW급 대형 원전 2기 건립 계획을 취소할 수 있다는 입장을 내비쳤다.◇ 주력 제조업 모두 ‘전기 갈증’철강, 중공업, 석유화학 등 한국의 제조업 근간이 ‘전기화(electrification)’하고 있는 것도 기저 전원이 시급한 이유다. 포스코의 전력 수요는 지난해 약 2.9GW에서 2050년 4.6GW로 늘어날 전망이다. 국내 철강업계는 탄소 감축 압력이 커지면서 석탄을 태워 쇳물을 생산하는 기존 고로 방식 대신 수소를 사용해 철을 환원하는 공정으로의 전환을 서두르고 있다.문제는 이 과정에서 전력 수요가 기하급수적으로 늘어난다는 점이다. 환원, 예열, 수소 생산, 전기 아크로 제강 등 핵심 공정 모든 단계에서 막대한 전기가 필요하다. 그간 제철소는 고로 공정에서 발생하는 부생가스로 필요 전력의 80% 이상을 자체 충당해 왔다. 그러나 수소환원제철 체제에서는 부생가스가 나오지 않아 전력을 외부 계통에서 대부분 조달해야 한다. 철강업계 관계자는 “수소환원제철은 전력다소비 공정의 총집합”이라며 “전력 계획이 뒷받침되지 않으면 상용화가 불가능하다”고 말했다.석유화학업계의 상황도 비슷하다. 한국에너지기술연구원에 따르면 석유화학의 핵심 공정인 스팀 크래커(열분해)는 전기 가열로를 도입하면 전력 수요가 기존 대비 19배 이상으로 급증한다. 전통적 스팀 크래커의 에너지 소모량은 t당 약 0.25㎿h지만 전기식으로 전환할 경우 4.8㎿h로 늘어난다.심형진 서울대 원자력미래정책연구소장은 “전력 수요가 급증하는 상황에서 신재생 중심 전략은 유연성이 낮다”며 “(크고 작은) 원전 설비까지 늘려나가는 에너지 믹스 정책을 써야 한다”고 강조했다.",반도체·방산…모든 산업으로 번지는 전력난정부 에너지 수급 계획은 불투명지난달 말 경남 거제 한화오션 조선소에서 진수한 국산 첫 3600t급 잠수함(장보고 Ⅲ-배치Ⅱ-1번함) 장영실함. 재래식 잠수함으로 역대 최고 성능을 갖춘 이 잠수함을 건조하는 데는 ‘전기 먹는 하마’로 불리는 육상기반시험설비(LBTS)가 필수다. 심해에서 30년가량 임무를 수행하는 잠수함의 배터리와 모터 등의 성능을 땅 위에서 검증하는 첨단 설비다. 글로벌 기업 중 제너럴일렉트릭(GE) 정도만 보유하고 있고 국내에는 경남 창원에 단 한 개 있다.창원 LBTS의 전기 소모량은 중대형 아파트 단지 한 곳(약 1000가구)이 쓰는 6메가와트(㎿)다. 한국이 앞으로 미국 추인 아래 핵추진 잠수함을 국내에서 건조한 뒤 전력화하려면 이보다 훨씬 큰...,https://n.news.naver.com/article/newspaper/015/0005213001?date=20251119,업계,0.948604796,2,0,
