신문사,제목,본문,본문_요약,링크,카테고리,예측점수,업계_키워드_개수,경영_키워드_개수,최종선택여부
한국경제,마음까지 따뜻한 겨울나기…신개념 가전으로 준비하세요,"휴롬, 필터만 갈아끼는 착즙기코웨이, 욕실 품격 높이는 비데 디자인안마의자·얼음정수기 크기는 확 줄여한샘, 깔끔한 수납 돋보이는 '유로키친'에이스침대, 화재 이재민에 희망 전달이건홀딩스, 오케스트라 연주 선보여홈앤쇼핑, 중소기업 우수제품 발굴겨울이 성큼 다가오면서 생활의 편의를 높여주는 각종 가전제품에 대한 관심도 커지고 있다. 실내에 있는 시간이 늘어난 소비자의 마음을 공략하기 위해 기업마다 혁신 제품을 잇달아 선보이고 있는 것이다.◇ 집 안을 더 편리하게 하는 혁신제품오랜 기간 착즙기 시장 대표 주자로 군림하고 있는 휴롬은 상업용 착즙기 ‘CE50’을 내놨다. ‘듀얼 프레스 스위칭 기술’을 최초로 적용해 재료와 메뉴에 따라 복잡한 과정 없이 필터만 빠르게 교체할 수 있도록 만들어 편의성을 높였다. 24시간 동안 구동할 수 있는 상업용 모터를 장착했다.버튼 하나로 3L 용량의 착즙기 통을 분리하지 않고 내부를 간단히 세척할 수 있는 기능도 추가했다. 세계 4대 디자인어워드로 꼽히는 ‘2025 일본 굿디자인어워드’ 우수상을 수상해 심미성을 인정받았다.집 안 인테리어와 신기술을 두루 고려한 혁신 제품도 나오고 있다. 코웨이가 선보인 ‘룰루 슬리믹 비데’는 통상 비데보다 얇은 83㎜의 두께가 특징이다. 핵심 부품을 소형화하고 감각적인 플랫 디자인을 적용해 기존 제품 대비 높이를 48％ 줄였다. 블루투스로 연동된 소비자의 휴대폰을 인식해 사용자별 미리 설정해 둔 맞춤 비데 기능을 제공한다.이 회사의 소형 안마의자 ‘비렉스 마인 플러스’도 기존 제품 대비 크기를 43％ 줄였다. 하체에 특화한 안마 시스템 ‘레그 컨버터블’을 적용해 안마 범위를 대폭 넓혔다. 공간 활용도를 높일 수 있는 20㎝ 초소형 크기의 얼음정수기도 내놨다. 특허 기술인 ‘듀얼 쾌속 제빙 시스템’을 통해 약 9분30초마다 신선한 얼음을 빠르고 안정적으로 생산한다.인테리어 전문기업 한샘도 소비자의 사용 경험을 반영한 제품군을 강화하고 있다. 깔끔한 디자인과 체계화된 수납을 두루 갖춘 한샘의 주력 라인업 브랜드 ‘유로키친’이 대표적이다. 지난달 27일 리뉴얼한 유로 700 그레이스는 고강도 강화유리와 알루미늄 프레임을 결합한 프리미엄 글래스도어로 주목받았다. 또 다른 리뉴얼 제품 유로 700 베일은 유럽 미장스타일의 스톤 질감을 고안해 소비자의 눈길을 끌었다. 중·고가 시장에서 점유율을 올리며 유로키친의 전체 매출은 전년 대비 13% 늘었다.◇ 소비자와 밀착 소통 넓혀제품 외에도 소비자에게 긍정적인 이미지를 심기 위한 브랜드 경영이 활발하다. 침구업체 에이스침대는 지난 3월 경상도 대형 화재에 따른 피해를 줄이기 위해 희망브리지 전국재해구호협회에 5억원을 전달했다. 7월부터 생활 기반을 잃은 주민들의 경제적 부담을 덜기 위해 ‘침대 구매 지원 캠페인’을 진행하고 있다.현재까지 소방관을 대상으로 총 15억원을 기부하는가 하면 루게릭병 환자를 위한 지원도 수년째 이어가고 있다. 2023년과 2024년 두 차례에 걸쳐 승일희망재단에 총 2억원을 기부해 국내 최초 루게릭요양병원 ‘승일희망요양병원’의 건립에 일조했다.이 밖에 한샘은 6월 서울 논현동 가구거리에 ‘플래그십 논현’을 리뉴얼해 소비자와의 접점을 넓혔다. 단순 전시가 아닌 체험과 상담, 설계를 결합한 프리미엄 매장으로 바꿔 플래그십 논현 매출은 전년 대비 77％ 증가했다. 이건홀딩스는 올해로 36년째인 ‘이건 음악회’를 열어 오케스트라 합주 연주를 선보인다. 첼로 듀오가 마이클 잭슨의 ‘스무스 크리미널’을 연주하고, 방탄소년단(BTS)의 ‘다이너마이트’를 현악으로 탈바꿈할 예정이다.중소기업 혁신 제품의 글로벌 진출도 늘어가고 있다. 홈앤쇼핑은 중소기업의 우수 상품을 발굴해 세계에 알리며 현재까지 76억원을 수출하는 성과를 냈다. 대만 사우디아라비아 독일 등 11개국에 43개 업체의 250여 개 상품 진출을 도왔다. 4월 열린 제23차 세계한인비즈니스대회에서는 수출 잠재력이 높은 20개 중소기업을 선발해 비즈니스 미팅, 바이어 투어, 피칭 프로그램 등 맞춤형 수출 연계 프로그램을 운영하기도 했다.전국 전통시장과 협력해 지역경제 활성화 및 소상공인 디지털 전환을 지원하는 ‘전통시장 살리기 프로젝트’를 진행하고 있다. 맞춤형 멘토링 서비스를 비롯해 판촉 지원, 홍보 콘텐츠 제작 등을 지원해 소상공인의 경쟁력 강화에 힘썼다.","휴롬, 필터만 갈아끼는 착즙기코웨이, 욕실 품격 높이는 비데 디자인안마의자·얼음정수기 크기는 확 줄여한샘, 깔끔한 수납 돋보이는 '유로키친'에이스침대, 화재 이재민에 희망 전달이건홀딩스, 오케스트라 연주 선보여홈앤쇼핑, 중소기업 우수제품 발굴겨울이 성큼 다가오면서 생활의 편의를 높여주는 각종 가전제품에 대한 관심도 커지고 있다. 실내에 있는 시간이 늘어난 소비자의 마음을 공략하기 위해 기업마다 혁신 제품을 잇달아 선보이고 있는 것이다.◇ 집 안을 더 편리하게 하는 혁신제품오랜 기간 착즙기 시장 대표 주자로 군림하고 있는 휴롬은 상업용 착즙기 ‘CE50’을 내놨다. ‘듀얼 프레스 스위칭 기술’을 최초로 적용해 재료와 메뉴에 따라 복잡한 과정 없이 필터만 빠르게 교체할 수 있도록 만들어 편의성을 높였다. 24시...",https://n.news.naver.com/article/newspaper/015/0005212865?date=20251119,경영,0.004512222,0,2,
매일경제,골프계 '제로' 열풍 뜨겁네 …'퍼터 명장' 스카티 카메론도 가세,"제로 토크 퍼터 인기 지속직진성 높고 관용성 좋아 선호김아림·김효주·황유민도 선택아마추어 골퍼들까지 사로잡아타이틀리스트·캘러웨이·PXG성능 '업' 신제품 출시 잇따라잠깐 유행하다가 사라질 줄 알았던 제로 토크 퍼터의 인기가 1년 가까이 지속되고 있다. 미국프로골프(PGA) 투어와 미국여자프로골프(LPGA) 투어, 한국여자프로골프(KLPGA) 투어 등 여러 우승자가 제로 토크 퍼터를 사용하면서 아마추어 골퍼들 사이에서도 열풍이 불고 있다.올해 제로 토크 퍼터가 한국 골프팬들에게 주목받기 시작한 건 지난 2월 LPGA 투어 2025시즌 개막전 힐튼 그랜드 베이케이션스 토너먼트 오브 챔피언스부터다. 김아림이 나흘간 단 한 번도 선두 자리를 내주지 않는 와이어투와이어 우승을 차지하는 데 제로 토크 퍼터가 핵심 역할을 했다는 사실이 알려지면서 위상이 달라졌다.이후에는 김효주, 노예림, 황유민 등이 제로 토크 퍼터 열풍에 불을 붙였다. 이외에도 수많은 선수가 제로 토크 퍼터를 들고나와 전 세계 주요 프로골프 투어 정상에 오르면서 식품업계에 이어 골프계에도 본격적으로 제로 유행이 시작됐다.제로 토크 퍼터를 제대로 이해하기 위해서는 먼저 토크를 알아야 한다. 토크는 퍼터 헤드가 샤프트 축을 중심으로 시계 방향 또는 시계 반대 방향으로 회전하려는 힘을 의미한다. 이로 인해 토크가 있는 기존 퍼터는 스트로크를 할 때 헤드가 열리거나 닫힌다. 반면 제로 토크 퍼터는 헤드가 회전하지 않기 때문에 스트로크 내내 퍼터 페이스가 목표 방향을 향하게 된다.제로 토크 퍼터의 강점은 직진성이다. 토크가 있는 일반 퍼터와 비교해 헤드 로테이션이 이뤄지지 않는 만큼 스트로크만 제대로 하면 공은 목표 지점으로 굴러간다. 김아림과 김효주, 황유민 등이 수많은 퍼터 중에서 제로 토크 퍼터를 고집하는 이유가 여기에 있다.이들은 ""제로 토크 퍼터로 교체한 뒤 2ｍ 이내 퍼트 성공률이 눈에 띄게 높아졌다. 직진성은 어떤 퍼터보다도 높다. 그린의 경사만 제대로 읽으면 홀에 들어간다는 확신이 생겼다. 앞으로도 제로 토크 퍼터를 사용하려고 한다""고 입을 모아 말했다.톱골퍼들이 새로운 퍼터로 교체하고 성적이 좋아진 뒤 유행이 된 사례는 몇 차례 있었다. 그러나 얼마 지나지 않아 골퍼들의 관심도는 줄어들었고 판매량도 빠르게 하락했다. 제로 토크 퍼터의 인기가 오랜 기간 지속되면서 랩골프, 캘러웨이, PXG, 이븐롤, 핑골프, 테일러메이드, 타이틀리스트 등 거의 모든 브랜드에서 제로 토크 퍼터를 출시했다.최근 가장 눈길을 끌고 있는 건 타이틀리스트 스카티 카메론 온셋 센터(OC) 퍼터다. 타이틀리스트는 제로 토크 퍼터가 퍼터 시장을 점령하고 있는 상황에서도 따로 출시하지 않았다. 선수들이 요청하는 경우에만 특별 제작해 제공했다.타이틀리스트는 이번에 선보인 온셋 센터 퍼터에 대해 ""오랜 연구 끝에 안정성과 감각의 완벽한 조화를 이룬 로 토크 퍼터가 탄생했다""고 설명했다.온셋 센터 퍼터의 샤프트는 헤드 리딩 에지보다 뒤쪽에 위치해 있다. 스트로크 과정에서 발생하는 비틀림을 최소화한 만큼 출시된 직후부터 많은 골퍼에게 관심을 받고 있다.지난달 롯데 챔피언십 정상에 오르며 내년도 LPGA 투어 출전권을 확보한 황유민이 사용하는 캘러웨이골프의 오디세이 Ai-ONE S2S MAX1(스퀘어 투 스퀘어 맥스 원)은 지금도 큰 인기를 끌고 있다. 이 퍼터는 헤드 중심에 샤프트를 배치한 설계로 백스트로크부터 임팩트까지 헤드의 불필요한 회전의 억제를 돕는다. 여기에 3.3도 기울어진 샤프트는 자연스러운 어드레스를 유도하면서 임팩트 때 페이스가 열리는 현상을 막아준다.PXG의 제로 토크 퍼터인 뱃어택 ZT도 수많은 골퍼들을 사로잡았다. 뱃어택 ZT의 핵심 기술은 PXG만의 독자적인 S 호젤이다.이 설계는 앞서 출시한 PXG 제로 토크 퍼터 시리즈인 앨런 퍼터를 기반으로 한다. 샤프트 축을 무게중심 위에 정렬해 스트로크 시 페이스 회전을 최소화했다. 303 스테인리스스틸 소재가 사용된 헤드 내부는 중공 구조의 형태로 퍼터 내부 공간의 약 31%를 PXG의 특허 기술인 S COR 폴리머가 채워 관성모멘트(MOI)를 극대화했다.김효주와 김아림이 사용하는 퍼터로 유명한 랩골프의 메즈.1(mezz.1) 등은 지금까지도 엄청난 인기를 끌고 있다. 2018년 처음 제로 토크 퍼터를 출시했던 랩골프는 정타가 맞지 않은 상황에서도 높은 관용성으로 균형 잡힌 퍼팅을 할 수 있도록 도와 오랜 기간 한국 골프팬들에게 사랑받고 있다.[임정우 기자]","제로 토크 퍼터 인기 지속직진성 높고 관용성 좋아 선호김아림·김효주·황유민도 선택아마추어 골퍼들까지 사로잡아타이틀리스트·캘러웨이·PXG성능 '업' 신제품 출시 잇따라잠깐 유행하다가 사라질 줄 알았던 제로 토크 퍼터의 인기가 1년 가까이 지속되고 있다. 미국프로골프(PGA) 투어와 미국여자프로골프(LPGA) 투어, 한국여자프로골프(KLPGA) 투어 등 여러 우승자가 제로 토크 퍼터를 사용하면서 아마추어 골퍼들 사이에서도 열풍이 불고 있다.올해 제로 토크 퍼터가 한국 골프팬들에게 주목받기 시작한 건 지난 2월 LPGA 투어 2025시즌 개막전 힐튼 그랜드 베이케이션스 토너먼트 오브 챔피언스부터다. 김아림이 나흘간 단 한 번도 선두 자리를 내주지 않는 와이어투와이어 우승을 차지하는 데 제로 토크 퍼터가 핵심 역할...",https://n.news.naver.com/article/newspaper/009/0005592123?date=20251119,업계,0.004263232,1,0,
동아일보,[대구판/게시판]대구 外,"〈알림〉 대구 □서구청년센터 청년마당 개소행사=20일 오후 3시∼4시 반. 식전 공연, 개소식, 유튜버 원샷한솔 초청 토크 콘서트, 체험 및 홍보 부스 등.□커피 & 카페 페스타=27∼29일 오전 10시∼오후 6시 엑스코 서관 2홀.□초등영어 겨울방학캠프=2026년 1월 11∼31일 말레이시아 및 싱가포르 일원. 소규모 영어 집중 수업과 문화 체험. 관내 소재 초등 6학년에 재학 중인 달성군 군민 30명(저소득층 6명). 참가비 무료(항공료, 여권 발급 비용 자부담, 저소득층은 항공료 지원). 달성군 홈페이지에서 지원서 내려 받아 21일 오후 5시까지 접수. 달성군 교육사업1팀.포항 □아동 인지행동발달 VR기기 검사=주의집중력, 작업기억력, 집행기능, 행동조절력, 충동자제력, 사회성 검사. VR기기 착용 후 실생활과 유사한 미션을 수행해 데이터 수집 후 결과 도출. 집중력 유지 및 행동 조절에 어려움이 있는 초등학생 대상. 무료. 북구정신건강복지센터.구미 □서울시발레단 ‘오하드 나하린―데카당스’=△21일 오후 7시 반 △22일 오후 3시 문화예술회관.","〈알림〉 대구 □서구청년센터 청년마당 개소행사=20일 오후 3시∼4시 반. 식전 공연, 개소식, 유튜버 원샷한솔 초청 토크 콘서트, 체험 및 홍보 부스 등.□커피 & 카페 페스타=27∼29일 오전 10시∼오후 6시 엑스코 서관 2홀.□초등영어 겨울방학캠프=2026년 1월 11∼31일 말레이시아 및 싱가포르 일원. 소규모 영어 집중 수업과 문화 체험. 관내 소재 초등 6학년에 재학 중인 달성군 군민 30명(저소득층 6명). 참가비 무료(항공료, 여권 발급 비용 자부담, 저소득층은 항공료 지원). 달성군 홈페이지에서 지원서 내려 받아 21일 오후 5시까지 접수. 달성군 교육사업1팀.포항 □아동 인지행동발달 VR기기 검사=주의집중력, 작업기억력, 집행기능, 행동조절력, 충동자제력, 사회성 검사. VR기기 착용 후...",https://n.news.naver.com/article/newspaper/020/0003675451?date=20251119,기타,0.004168598,0,0,
조선일보,5년 만에 자동차보험료 인상 요구 나선 보험사들,"올해 7000억~8000억원 적자 우려‘포용 금융’ 기조 속 금융당국은 “난감”연말 자동차보험료율 결정을 앞두고 손해보험사들 사이에서 5년 만에 올려야 한다는 주장이 나오고 있다. 반면 금융사의 사회적 기여를 강조하는 정부 기조 탓에 금융 당국은 난감하다는 반응이다.18일 손해보험업계에 따르면, 삼성화재는 지난 13일 3분기(7~9월) 실적 설명회(콘퍼런스콜)에서 “현재 합산비율(보험사의 적자 수준을 보여주는 지표)을 고려할 때 내년에 자동차보험료 인상에 대해 검토 중인 상황임을 알려 드린다”고 했다. 삼성화재는 3분기 자동차보험에서 648억원의 적자를 기록했다.DB손해보험(558억원), 현대해상(553억원), KB손보(442억원) 등 여타 대형 보험사들도 3분기에 나란히 적자를 봤다. 손해보험업계는 올해 자동차보험에서 7000억~8000억원의 적자를 예상하고 있다. 전체 자동차보험 시장(20조원)의 3~4% 수준이다. 업계 관계자는 “내년에 적자를 면하려면 보험료율을 3~4%포인트 올려야 한다는 뜻”이라고 했다. 급격한 인상이 어렵다면 적어도 1%포인트 안팎이라도 올리는 게 불가피하다는 말도 나온다.자동차보험료율은 연말마다 각 보험사가 자율적으로 결정해 보험개발원 등에서 검증을 받는 구조다. 하지만 검증 과정에서 금융 당국의 실질적인 통제를 받는다. 자동차보험은 차량을 구매하면 반드시 가입해야 하는 의무 보험으로 물가에도 반영돼, 금융 당국이 인상 여부와 수준을 세밀하게 관리한다는 게 업계 설명이다.보험사들은 앞서 2021년부터 작년까지 매년 0.6~2.8%씩 자동차보험료율을 낮췄다. 코로나로 차량 운행이 줄었던 영향에, 서울시가 도심 최고 속도를 시속 50㎞로 제한하면서 사고가 줄어든 것을 반영했다. 윤석열 정부가 ‘상생 금융’을 앞세워 보험료율 인하를 압박한 여파도 컸다. 그러나 이후 교통량이 회복되고 잇따른 여름철 집중호우로 침수 차량이 속출했다. 누적된 물가로 카센터가 부품과 공임비 인상을 요구하기도 했다.이재명 정부 들어서도 표현만 ‘포용 금융’으로 바뀌었을 뿐, 금융사를 압박하는 기조는 그대로인 탓에 금융 당국은 고심에 빠진 상황이다. 자동차 보험료율을 올렸다가 내년 지방선거에 악영향을 끼칠 수 있다는 ‘정무적’ 판단도 불가피하다.","올해 7000억~8000억원 적자 우려‘포용 금융’ 기조 속 금융당국은 “난감”연말 자동차보험료율 결정을 앞두고 손해보험사들 사이에서 5년 만에 올려야 한다는 주장이 나오고 있다. 반면 금융사의 사회적 기여를 강조하는 정부 기조 탓에 금융 당국은 난감하다는 반응이다.18일 손해보험업계에 따르면, 삼성화재는 지난 13일 3분기(7~9월) 실적 설명회(콘퍼런스콜)에서 “현재 합산비율(보험사의 적자 수준을 보여주는 지표)을 고려할 때 내년에 자동차보험료 인상에 대해 검토 중인 상황임을 알려 드린다”고 했다. 삼성화재는 3분기 자동차보험에서 648억원의 적자를 기록했다.DB손해보험(558억원), 현대해상(553억원), KB손보(442억원) 등 여타 대형 보험사들도 3분기에 나란히 적자를 봤다. 손해보험업계는 올해 ...",https://n.news.naver.com/article/newspaper/023/0003941725?date=20251119,경영,0.004149958,0,1,
매일경제,올시즌 평정한 남녀 챔피언들 … '비밀병기' 덕분이었네,"올해를 빛낸 프로골퍼 드라이버유현조, 핑골프 G430으로 대상방신실·홍정민은 '테일러메이드'옥태훈 '캘러웨이 엘리트' 사용남자골프 최강자로 자리매김2025시즌 국내 남녀 프로골프에서는 '꾸준함'이 돋보였던 골퍼가 가장 빛났다. 한국여자프로골프(KLPGA) 투어 대상 포인트 1위를 달성한 유현조, 한국프로골프(KPGA) 투어 제네시스 대상 1위에 오른 옥태훈의 올 시즌 경기력에서 '꾸준함'이 공통적으로 나타났다.유현조는 올해 KLPGA 투어 29개 대회에서 우승은 한 차례였지만 컷 통과 27회, 톱10에는 19차례나 들면서 대상, 평균타수 1위로 다른 골퍼들을 압도했다. 옥태훈은 KPGA 투어에서 20개 대회에 출전했고 3승을 포함해 10차례 톱10에 올라 대상뿐 아니라 상금, 평균타수 등 각종 주요 타이틀을 모두 휩쓸었다.어떤 환경에서든 꾸준하게 최상의 경기력을 내기는 쉽지 않다. 그만큼 올해 '챔피언 골퍼'들이 어떤 장비를 쓰는지 눈길이 간다. 그중에서도 '똑바로, 멀리'를 가장 잘 구현하는 클럽, 드라이버에 쏠리는 관심이 가장 크다.유현조는 올해 핑골프의 G430 LST 드라이버를 사용했다. 지난해부터 이 모델을 사용한 유현조는 올해도 G430 LST 드라이버로 비거리에 자신감을 드러냈다. 올 시즌 유현조의 드라이버샷 평균 비거리는 KLPGA 15위(249.63야드), 준수한 거리 감을 과시했다. G430 모델 중 저스핀 모델로 출시됐던 이 드라이버는 무게중심을 낮춰 스핀을 줄인 기술로 비거리를 늘리는 효과가 특징적이다. 카본 크라운을 입힌 클럽의 헤드 후면에는 이동식 텅스텐 추를 더해 다양한 구질을 만들 수 있는 장점도 있다.핑골프의 드라이버는 올해 KLPGA 투어에서 특히 돋보였다. 노승희, 박현경, 정윤지 등 최신 드라이버인 G440으로 7승을 합작해냈다. G440은 잠자리 날개에서 착안한 '드래건플라이 테크놀로지'를 적용한 8겹의 카본을 힐과 토까지 감싸 낮은 무게중심을 실현한 게 돋보이는 드라이버다. 이를 통해 높은 관용성과 빠른 볼 스피드를 경험할 수 있다.여기에다 '프리 호젤' 기술을 적용시켜 호젤(헤드와 샤프트의 연결 부분)이 위치한 헤드 안쪽을 가볍게 해 중심을 벗어나 맞은 볼의 비거리와 방향 손실이 덜한 스위트 스폿을 안쪽으로 더 확대시켰다.옥태훈은 캘러웨이골프의 엘리트 트리플 다이아몬드(TD) 드라이버로 국내 남자 골프를 평정했다. 올해 초 선보였던 엘리트 시리즈 드라이버 중에서 낮은 스핀 양과 발사각으로 투어 레벨의 퍼포먼스를 원하는 골퍼를 위한 모델이다. 헤드 앞뒤로 무게중심을 둘 수 있도록 해 안정성을 높이거나 낮은 스핀을 설정할 수 있다. 여기에다 공기역학 헤드 디자인과 Ai 10x 페이스, 관성모멘트를 극대화한 신소재 서모포지드 카본 크라운 등 신기술도 눈길을 끈다. 올해 엘리트 트리플 다이아몬드는 특히 미국여자프로골프(LPGA) 투어 롯데 챔피언십 우승으로 내년 미국 무대에서 뛰는 황유민의 드라이버로도 주목받았다.올 시즌 KLPGA 투어에서 다승, 상금 부문 1위를 거둔 다른 골퍼들의 드라이버도 주목할 만하다. 올 시즌 3승을 거둔 방신실은 테일러메이드의 신형 드라이버 Qi35를 들고나와 각종 대회에서 안정적인 장타를 뽐냈다. 실제로 올 시즌 그는 KLPGA 투어에서 평균 258.75야드의 드라이버샷 거리를 기록해 전체 2위에 올랐다. Qi35는 KLPGA 투어 평균 드라이버샷 1위(261.06야드)에 오른 이동은이 사용하는 드라이버이기도 하다.골퍼가 직접 조절할 수 있는 셀프 피팅 시스템이 적용된 Qi35는 효율적인 무게중심 조정을 구현해 골퍼가 원하는 구질과 컨트롤을 할 수 있는 특징이 있다. 테일러메이드 자체 테스트 결과 직전 모델(Qi10)보다 관용성이 크게 향상돼 13g 웨이트를 후방에 설정하면 13% 더 일관된 랜딩 존이 형성되는 것으로 나타났다. KLPGA 투어 다승 공동 1위, 상금 부문에서는 개인 첫 1위를 달성한 홍정민은 테일러메이드의 다른 드라이버로 시즌을 평정했다. 2023년에 선보인 테일러메이드 스텔스의 두 번째 모델, 스텔스2 플러스다. 테일러메이드 역사상 가장 많은 카본 소재를 드라이버 헤드에 사용한 스텔스2 중에서도 스핀이 가장 적은 모델이다. 15g의 슬라이딩 웨이트 트랙을 사용해 골퍼가 원하는 구질을 만들 수 있다.[김지한 기자]","올해를 빛낸 프로골퍼 드라이버유현조, 핑골프 G430으로 대상방신실·홍정민은 '테일러메이드'옥태훈 '캘러웨이 엘리트' 사용남자골프 최강자로 자리매김2025시즌 국내 남녀 프로골프에서는 '꾸준함'이 돋보였던 골퍼가 가장 빛났다. 한국여자프로골프(KLPGA) 투어 대상 포인트 1위를 달성한 유현조, 한국프로골프(KPGA) 투어 제네시스 대상 1위에 오른 옥태훈의 올 시즌 경기력에서 '꾸준함'이 공통적으로 나타났다.유현조는 올해 KLPGA 투어 29개 대회에서 우승은 한 차례였지만 컷 통과 27회, 톱10에는 19차례나 들면서 대상, 평균타수 1위로 다른 골퍼들을 압도했다. 옥태훈은 KPGA 투어에서 20개 대회에 출전했고 3승을 포함해 10차례 톱10에 올라 대상뿐 아니라 상금, 평균타수 등 각종 주요 타이틀을...",https://n.news.naver.com/article/newspaper/009/0005592110?date=20251119,기타,0.004034873,0,0,
